Title job,Employer,Link profile employer,Location,How long ago,Recruiter,Profile recruiter,Description offer,Link offer
Analista QA,Periferia IT Group,https://co.linkedin.com/company/periferia-it-group?trk=public_jobs_jserp-result_job-search-card-subtitle,"Lima, Peru",2 hours ago,,,"¡Es hora de vivir un nuevo viaje con Periferia IT Group! 🌟 Si tienes experiencia o interés en Analista QA y buscas hacer un impacto en el mundo tecnológico, esta es tu oportunidad de unirte a nuestro equipo. Trabajarás con más de 1,000 profesionales en una multinacional colombiana líder en el sector",https://pe.linkedin.com/jobs/view/analista-qa-at-periferia-it-group-4287566093?position=1&pageNum=0&refId=KgfUJgOex9iUY6G11PUUZQ%3D%3D&trackingId=u18mT3o1dasviUq1o8YaCA%3D%3D
Lider QA,Seek,https://pe.linkedin.com/company/seekglobal?trk=public_jobs_jserp-result_job-search-card-subtitle,"Lima, Peru",8 hours ago,,,"Somos SEEK, una empresa nacida de la búsqueda constante por el conocimiento, el aprendizaje y el hacer lo que nos apasiona. Somos un equipo multidisciplinario enfocado en diseñar y desarrollar experiencias digitales centradas en el usuario, que generen valor real y tengan impacto positivo en diversa",https://pe.linkedin.com/jobs/view/lider-qa-at-seek-4285025703?position=2&pageNum=0&refId=KgfUJgOex9iUY6G11PUUZQ%3D%3D&trackingId=U7sfEG86DMYHWucRqPnqvA%3D%3D
Analista QA,Talently,https://www.linkedin.com/school/talentlytech/?trk=public_jobs_jserp-result_job-search-card-subtitle,"Lima, Peru",5 hours ago,,,"Principales funcionesAnalizar la documentación funcional o historias del software a probar.Elaborar el plan de pruebas.Diseñar matriz de casos de prueba que cubran diferentes escenarios y funcionalidades del software (datos de entrada, acciones del usuario, resultados esperados y criterios de acepta",https://pe.linkedin.com/jobs/view/analista-qa-at-talently-4287997682?position=3&pageNum=0&refId=KgfUJgOex9iUY6G11PUUZQ%3D%3D&trackingId=u1MiK1rRRZmNrN%2FphauXgA%3D%3D
Chapter Leader QA,Inetum,https://fr.linkedin.com/company/inetum?trk=public_jobs_jserp-result_job-search-card-subtitle,"Lima, Peru",10 hours ago,,,"Somos Inetum, una compañía de servicios ágiles que proporciona soluciones digitales y un grupo global de tecnólogos que acompaña a sus clientes en el proceso de digitalización aprovechando al máximo el digital flow.Ofrecemos a nuestros clientes una combinación única de proximidad, organización secto",https://pe.linkedin.com/jobs/view/chapter-leader-qa-at-inetum-4285009956?position=4&pageNum=0&refId=KgfUJgOex9iUY6G11PUUZQ%3D%3D&trackingId=Q1fqg4S41m%2FnO3fcj93jkA%3D%3D
Analista de aseguramiento de la calidad,Ayesa,https://es.linkedin.com/company/ayesa?trk=public_jobs_jserp-result_job-search-card-subtitle,"Lima, Peru",2 hours ago,Carlos Huapaya,https://pe.linkedin.com/in/carlos-huapaya-a42036267,"Estimada red,Nos encontramos en búsqueda de un ANALISTA QA SAP para un proyecto clave en el sector de Energía.¿Qué buscamos?Profesionales titulados en Ingeniería de Sistemas, Informática o carreras afines.De 3 a 5 años de experiencia en Pruebas funcionales, integrales (E2E), regresión y aceptación d",https://pe.linkedin.com/jobs/view/analista-de-aseguramiento-de-la-calidad-at-ayesa-4288320337?position=5&pageNum=0&refId=KgfUJgOex9iUY6G11PUUZQ%3D%3D&trackingId=brLFG8huBHT4WeeA3tO9eA%3D%3D
Data Analytics – AI/Chatbot Engineer,Flexi.cx,https://www.linkedin.com/company/flexicx?trk=public_jobs_jserp-result_job-search-card-subtitle,"Lima, Peru",1 hour ago,,,,https://pe.linkedin.com/jobs/view/data-analytics-%E2%80%93-ai-chatbot-engineer-at-flexi-cx-4288324468?position=6&pageNum=0&refId=KgfUJgOex9iUY6G11PUUZQ%3D%3D&trackingId=h10aQv%2F%2Fo3m8BYCA7%2Bs%2BNA%3D%3D
Investment Operations Analyst,Havas Perú,https://pe.linkedin.com/company/havas-group-per%C3%BA?trk=public_jobs_jserp-result_job-search-card-subtitle,"Lima, Peru",2 hours ago,,,"ResponsabilitiesBilling Entry with Prisma for biddable channels: Search, Social, and ProgrammaticCoordinate with partners to confirm monthly expenses and update pacing documents.Registration of packages and placements, sending IOs and CAFs, and coordination with teams for QA and activation.Preparati",https://pe.linkedin.com/jobs/view/investment-operations-analyst-at-havas-per%C3%BA-4285044917?position=7&pageNum=0&refId=KgfUJgOex9iUY6G11PUUZQ%3D%3D&trackingId=t0YkVjzqIKhrGWH23UgGZw%3D%3D
Chapter Lead,Inetum,https://fr.linkedin.com/company/inetum?trk=public_jobs_jserp-result_job-search-card-subtitle,"Lima, Peru",6 hours ago,,,"Somos Inetum, una compañía de servicios ágiles que proporciona soluciones digitales y un grupo global de tecnólogos que acompaña a sus clientes.Ofrecemos a nuestros clientes una combinación única de proximidad, organización sectorial y soluciones de calidad. Presente en más de 26 países, el grupo ti",https://pe.linkedin.com/jobs/view/chapter-lead-at-inetum-4287984761?position=9&pageNum=0&refId=KgfUJgOex9iUY6G11PUUZQ%3D%3D&trackingId=lmnN9ZbveaKrQ9hX%2F7%2BLXw%3D%3D
Supervisor CQA - Minería / Puno,WSP en Perú,https://pe.linkedin.com/company/wsp-en-peru?trk=public_jobs_jserp-result_job-search-card-subtitle,"Lima, Peru",11 hours ago,,,"Description ¿Quiénes Somos? WSP es una firma global de consultoría y servicios profesionales, pionera en asesoría estratégica, ingeniería y diseño. Nuestra presencia multinacional y liderazgo en ingeniería y medio ambiente nos posicionan en la cúspide del sector.En WSP además valoramos la diversidad",https://pe.linkedin.com/jobs/view/supervisor-cqa-miner%C3%ADa-puno-at-wsp-en-per%C3%BA-4221791592?position=10&pageNum=0&refId=KgfUJgOex9iUY6G11PUUZQ%3D%3D&trackingId=VcXgRriIq60oKpxDftyNaA%3D%3D
