Title job,Employer,Link profile employer,Location,How long ago,Recruiter,Profile recruiter,Description offer,Link offer
Analista QA Funcional,Indra,https://es.linkedin.com/company/indra?trk=public_jobs_jserp-result_job-search-card-subtitle,"San Isidro, Peru",23 hours ago,Camila Espinoza,https://pe.linkedin.com/in/camila-espinoza-7330ba150,"Estamos en la búsqueda de este puesto para que sea nuestro representante frente a una empresa del rubro de seguros.( 1) Analista QA Funcional🎯 ¿Qué buscamos en ti?Profesional universitario o técnico de Ingeniería de Sistemas, Informática o carreras afines.Experiencia de 4.5 - 5 años como Analista de QA Funcional.Experiencia en metodologías y modelos de calidad: CMMI, ISTQB, Modelo en V, RUP.Experiencia con metodologías de desarrollo (ágiles y tradicionales).Manejo de herramientas de pruebas, seguimiento de defectos y documentación.Experiencia en testing funcional, regresión, integración, aceptación, volumen, smoke test y performance.Experiencia en el uso de lenguaje Gherkin.Experiencia en bases de datos y lenguajes de consulta (SQL).Familiaridad con prácticas ágiles: Scrum, UML, TDD, BDD, IC.Nivel básico en automatización y scripting.💼 ¿Cuáles serán tus retos?Diseñar planes y casos de prueba, definiendo la estrategia de testing adecuada para cada proyecto.Preparar datos de prueba y verificar los productos desarrollados.Ejecutar pruebas funcionales, registrar defectos y hacer seguimiento hasta su resolución.Analizar y reportar resultados de pruebas, métricas y estadísticas.Brindar soporte en procesos de integración y asegurar el cumplimiento de estándares de calidad.💡 Beneficios exclusivosHorario: Lunes a Viernes de 9am a 6pmModelo de trabajo: híbrido-3 veces a la semana en las oficinas del cliente-San Isidro.EPS cubierto al 100% en Plan BaseUdemy acceso totalLínea de CarreraKit ergonómico para laborar desde casa¡Anímate y postula con nosotros!",https://pe.linkedin.com/jobs/view/analista-qa-funcional-at-indra-4313419545?position=1&pageNum=0&refId=ibvtIpBSpIoX5Bhd6o1mDw%3D%3D&trackingId=mn%2FKBqMiSkNuIZDyM8QHEw%3D%3D
Senior QA Automation,Valtx Perú,https://pe.linkedin.com/company/valtx-peru?trk=public_jobs_jserp-result_job-search-card-subtitle,"San Borja, Peru",9 hours ago,,,"En Valtx, empresa con 24 años de experiencia en el mercado peruano, cuyo objetivo principal es convertirse en un socio estratégico, mediante soluciones tecnológicas en los diversos aspectos de los procesos de negocios; el desarrollo, implementación y mantenimiento de aplicaciones e infraestructura tecnológica para el negocio; y consultoría en diversos procesos de transformación, nos encontramos en la búsqueda de un ANALISTA QA¿Qué responsabilidades tendrá?Implementar la estrategia de calidad para transformaciones de banca digital con foco en contabilidad.Diseñar frameworks de pruebas para sistemas financierosValidar integridad de datos en procesos de consolidación corporativaAsegurar compliance en reportes regulatorios (SOX, IFRS)Actuar como puente entre áreas de Negocio y TIRealizar pruebas manuales y automatizadas sobre las aplicaciones y plataformas desarrolladasGenerar los planes y casos de pruebas funcionales y no funcionalesIdentificar, reportar y hacer seguimiento de los defectos encontrados.Colaborar estrechamente con el equipo de desarrollo para la resolución de defectos.Documentar el proceso de aseguramiento de calidad y el resultado de las pruebas.¿Qué requisitos necesito?FormaciónBachiller o egresado de la Carrera de Ingeniería de Sistemas, Informática o afines.Experiencia6 años en QA de sistemas financieros con experiencia en implementaciones ERP, Participación en proyectos de transformación digital financiera con experiencia en pruebas automatizadasConocimientosPruebas AutomatizadasPruebas End-To-End de ventas de productos financieros (prestamos, tarjetas, cuentas y seguros).Diseño de plan de pruebas y casosArquitectura de sistemas contables (GL, AP, AR, Asset Mgmt)Pruebas de interfaces bancarias y fiscales (CFDI, Facturación ElectrónicaData Analytics para detección de anomalías contablesAutomatización avanzada (BDD para reglas contables complejas)Seguridad financiera (roles y accesos, segregación de funciones)Conocimientos básicos en SOX, ISO 27001, PCI-DSSConocimientos DeseablesAutomatización: Selenium, Appium, Cypress, Katalon Studio.Pruebas de rendimiento/Seguridad: JMeter, SonarQube, OwasZAP, BurpSuite.Gestión de pruebas: JIRA, TestRail, Zephyr.Consumo de APIs: Postman, SoapUI, Swagger.Conocimiento de analisis de datos: SQL avanzado, Power BI, Excel PowerQuery, Python (básico para data profiling)ETL / Data QA: Validación de cargas contables (Extract, Transform, Load) con herramientas como Talend o PentahoDisponibilidad para laborar presencial de L-V en San Isidro¿Por qué Valtx?Porque creemos que el talento se potencia con propósito. En Valtx no solo desarrollamos tecnología, transformamos negocios y acompañamos a nuestros colaboradores en su desarrollo profesional, promoviendo una cultura colaborativa, cercana y orientada a la excelencia.¿Estás listo para construir soluciones que marcan la diferencia?Postula hoy y forma parte de un equipo que evoluciona contigo.",https://pe.linkedin.com/jobs/view/senior-qa-automation-at-valtx-per%C3%BA-4313633247?position=2&pageNum=0&refId=ibvtIpBSpIoX5Bhd6o1mDw%3D%3D&trackingId=wzEP699q8y0IaF7ppTapIQ%3D%3D
QA Automation Lead,Compartamos Banco Perú,https://pe.linkedin.com/company/compartamosbancoperu?trk=public_jobs_jserp-result_job-search-card-subtitle,"Lima, Peru",22 hours ago,Silvia Dongo Perez,https://pe.linkedin.com/in/silvia-beatriz-dongo-perez,"En Compartamos Banco, parte del Grupo Gentera con presencia en México y Perú. Llevamos más de 30 años brindando soluciones financieras a los microempresarios/as peruanos/as. Apostamos por la innovación, la tecnología y un servicio con sentido humano para seguir creciendo y ofreciendo mejores oportunidades. Con más de 7,000 colaboradores y 126 agencias en todo el país, estamos evolucionando y queremos que tú seas parte de este gran reto.Nos encontramos en búsqueda de un o una QA Automation Lead para contribuir a nuestro gran objetivo: servir a 2 millones de personas en 2026.¿Cuáles serían tus funciones?Desarrollar estrategias de prueba, planes y mantener los datos de prueba de automatización.Promover la identificación, selección e implementación de herramientas, tecnologías y prácticas que respaldan el proceso control de calidad con enfoque a la automatización de pruebas de las soluciones encargadas.Desarrollar y mejorar continuamente las pruebas automatizadas a medida que se desarrollan nuevas características y mejoras del sistema.Liderar y brindar soporte técnico al equipo asignado para la obtención de los resultados planificados.Asegurar de que los entornos de prueba y las infraestructuras adecuadas estén en su lugar y se mantengan actualizados.Integrar las soluciones de pruebas automatizadas en un marco de CI/CD de Jenkins/Azure DevOps.Proponer y desarrollar testing automatizados, para aplicar a los proyectos asignados en coordinación y según estrategia y en coordinación con los consultores de calidad de software.Contribuir a estimaciones de tiempo precisas para el desarrollo de automatización de pruebas.Documentar y asesorar a los consultores de calidad de software en el uso del marco de automatización de pruebas implementado.RequisitosEres nuestro candidato o candidata ideal si:Bachiller o titulado de Ingeniería de Sistemas, Informática o afines.Experiencia asumiendo roles de liderazgo y soporte a equipo para transmitir los lineamientos y buenas prácticas de automatización.Experiencia de 4 años diseñando e implementando marcos de automatización en API Testing, Web y Mobile, participando en proyectos del sector de Banca o afines.Experiencia de 3 años elaborando, configurando y ejecutando planes de pruebas funcionales, regresión y rendimiento.Dominio del proceso de control de calidad de software basados en ISQTB. (Certificado ISTQB Foundation Level - Obligatorio).Conocimiento pruebas de performance como Jmeter.Experiencia en seguimiento de errores, métricas e indicadores de calidad.Experiencia en herramientas de gestión de pruebas con lenguajes de programación (Java, Net, APIS); y gestores de base de datos DB2/SQL.Experiencia implementando pruebas automatizadas como: Selenium, Cucumber, Appium, Postman, SOAPUI, Karate SDL, Maven, etc.Conocimiento y experiencia de metodología de trabajo Agile / Scrum Conocimiento de prácticas de integración continua, despliegue continuo, testing continuo: Pipelines (Jenkins/azure devops), análisis de Código Estático (SonarQube), GIT.BeneficiosTrabajo híbridoExcelente clima laboral (#4 Ranking GPTW Perú)EPS a costos compartidosTarjeta de alimentosCuponera de tiempo librePrograma Super Voluntario y Compartamos con la ComunidadAsesoría gratuita en psicología, nutrición y derecho familiar (para colaboradores y familiares directos)",https://pe.linkedin.com/jobs/view/qa-automation-lead-at-compartamos-banco-per%C3%BA-4313408972?position=3&pageNum=0&refId=ibvtIpBSpIoX5Bhd6o1mDw%3D%3D&trackingId=5U2xIWRgvutsbBwy7kxF0Q%3D%3D
QA Engineer (Python/Selenium),Talan,https://fr.linkedin.com/company/talan?trk=public_jobs_jserp-result_job-search-card-subtitle,Lima Metropolitan Area,8 hours ago,,,"Join Us!Why Talan?For the 4th consecutive year, Talan Spain has been recognized as a Great Place to Work! 🎉 This year, we’re also celebrating our 2nd certification in Poland, a significant milestone since opening our office there.Talan is an international advisory group specializing in innovation and transformation through technology, with 5,000 employees and an annual turnover of 600M€.We offer our customers a continuum of services to support them at each key stage of their organization's transformation, with four main activities:CONSULTING in Management and Innovation: Supporting business, managerial, cultural, and technological transformations. DATA & TECHNOLOGY: Implementing major transformation projects. CLOUD & APPLICATION SERVICES: Building or integrating software solutions. SERVICE CENTERS of EXCELLENCE: Providing technology, innovation, agility, sustainability of skills, and cost optimization. Talan accelerates its clients' transformation through innovation and technology. By understanding their challenges and supporting them with technology, innovation, and data, we enable them to be more efficient and resilient.Job DescriptionWe are looking for a QA Engineer profile that is capable of performing manual tests and automating tests using python and selenium.You will be responsible for understanding the different tasks, building a suitable test plan based on acceptance criteria, running and maintaining automated test cases ensuring software quality at all levels. (FrontEnd, BackEnd, Performance). We also want a proactive person who proposes improvements to the process that we have and is able to implement them.  QualificationsAnalytical and problem-solving skills. Teamwork, proactivity and good communication in multidisciplinary teamsAttention to detail and critical thinking. Focus on continuous improvement. Knowledge of development of automation with python and seleniumExperience in the use of management tools such as Jira and ConfluenceExperience in frontend testing, api rest, database and performance or at least have an idea. Maintenance of automated testsAdditional InformationWhat do we offer you?Full-time contract. Smart Office Pack so that you can work comfortably from home. Training and career development. Benefits and perks such as private medical insurance, life insurance. Possibility to be part of a multicultural team and work on international projects. This is a hybrid position based in Málaga, Spain. Relocation is mandatory.Possibility to manage work-permits. If you are passionate about development & tech, we want to meet you! Talan Spain’s commitment to non-discrimination based on gender, race, ideology, or any other reason, in accordance with the company’s ""Equality Plan"" and the current regulations on gender equality between women and men (Royal Decree-Law 6/2019).",https://pe.linkedin.com/jobs/view/qa-engineer-python-selenium-at-talan-4213310266?position=4&pageNum=0&refId=ibvtIpBSpIoX5Bhd6o1mDw%3D%3D&trackingId=8syNbqxUFpRFVjFA2qz1Rg%3D%3D
Especialista en Control de Calidad,Orienta Consultores,https://www.linkedin.com/company/orienta-consultores?trk=public_jobs_jserp-result_job-search-card-subtitle,"Miraflores, Peru",5 hours ago,,,,https://pe.linkedin.com/jobs/view/especialista-en-control-de-calidad-at-orienta-consultores-4313637681?position=5&pageNum=0&refId=ibvtIpBSpIoX5Bhd6o1mDw%3D%3D&trackingId=W5ykonvHoKMCWjyFwN9UiA%3D%3D
Analista Programador  Senior,Salog,https://pe.linkedin.com/company/salog?trk=public_jobs_jserp-result_job-search-card-subtitle,"Callao, Constitutional Province of Callao, Peru",9 hours ago,,,"SALOG- SALUTARE. Empresa peruana que viene implementando mejoras sustanciales en el sistema de abastecimiento de medicamentos e insumos médicos en el Perú.Nos encontramos en la búsqueda del mejor talento para desempeñarse en el puesto de Analista Programador Senior.Requisitos Bachiller en Ing. Industrial, Administración y/o Sistemas o a fines. Experiencia de 2 años en el cargo de Programador en desarrollo de aplicaciones para implementacion. Conocimiento de Gerencia de Proyectos Conocimiento en programación Nivel Básico en JavaScript, Java, PHP, C/C++, C#, Python. Conocimiento en manejo de Base de datos básico en Oracle, MySql, Mongo, BigQuery. Conocimiento en programación Mobile. (Deseable)FuncionesAnalizar la documentación de negocio y de ingeniería para definir la viabilidad del desarrollo del producto.Establecer tiempos estimados de entrega de los productos a desarrollar.Desarrollar los aplicativos según las especificaciones definidas.Desarrollar la integración de los sistemas que se comunicarán con los productos finales.Apoyar en la elaboración de arquitecturas de Software.Crear soluciones de desarrollo para disminuir el tiempo de implementación.Investigar y proponer nuevas tecnologías de BIGDATA.Investigar y proponer frameworks web para desarrollo en nube.Desarrollar interfaces de conexión con otros sistemas.Realizar las pruebas de los productos en ambiente de desarrollo.Elaborar la documentación para publicaciones en QA y coordinar con el encargado de base de datos para ejecutar los pases en dicho ambiente.Efectuar ajustes y cambios respecto a los procesos según las definiciones de Procesos de Negocio.BeneficiosIngreso a planillaRemuneración acorde al mercadoLinea de CarreraBonos y Tarjeta de alimentos",https://pe.linkedin.com/jobs/view/analista-programador-senior-at-salog-4313634233?position=6&pageNum=0&refId=ibvtIpBSpIoX5Bhd6o1mDw%3D%3D&trackingId=gIxEvevC%2B2jmvyJ4SoPgAg%3D%3D
Analista Programador Fullstack,KasNet,https://pe.linkedin.com/company/kasnet?trk=public_jobs_jserp-result_job-search-card-subtitle,"Santiago de Surco, Peru",9 hours ago,,,"¡ESTAMOS EN BÚSQUEDA DE TU TALENTO!KasNet, la empresa líder en la gestión de la red de agentes corresponsales multibanco, se encuentra en la búsqueda de un Analista Programador para incorporarse a su equipo. Si cuentas con interés en desarrollarte en dicha área y manejo de operaciones bancarias, esta oportunidad es para ti.FuncionesAnálisis y diseñoAnalizar requerimientos funcionales y técnicos para transformarlos en soluciones de software eficientes. Diseñar arquitecturas robustas y escalables en backend y frontend. Desarrollo y mantenimientoProgramar y mantener aplicaciones en Java utilizando frameworks como Spring Boot y Hibernate.Diseñar y desarrollar aplicaciones móviles nativas para la plataforma Android utilizando Java y/o Kotlin.Implementar y consumir APIs RESTful para la integración con sistemas backend.Colaborar con diseñadores, QA y otros desarrolladores para garantizar que las aplicaciones cumplan con los requerimientos funcionales y no funcionales.Base de datosDiseñar y optimizar estructuras de bases de datos relacionales (PostgreSQL, MySQL, Oracle) y no relacionales (MongoDB).Crear y ejecutar consultas SQL avanzadas. Control de calidadRealizar pruebas unitarias y de integración con herramientas como JUnit y Mockito.Participar en revisiones de código y garantizar el cumplimiento de estándares de desarrollo.Implementación y despliegueConfigurar y desplegar aplicaciones en entornos de servidores como WildFly o Tomcat. Utilizar herramientas de CI/CD (Jenkins, GitLab CI) para gestionar integraciones y despliegues continuos.Trabajar en equipo bajo metodologías ágiles (Scrum/Kanban). Proporcionar soporte técnico y capacitar a usuarios clave cuando sea necesario.RequisitosTítulo universitario en Ingeniería en Sistemas, Informática, Computación o carreras afinesDeseable contar con Certificaciones en Java (por ejemplo, Oracle Certified Professional Java Programmer - OCPJP)BackendExperiencia con Java SE y Java EE (Java 8 o superior, preferiblemente Java 17).Manejo de frameworks: Spring Framework (Spring Boot, Spring MVC, Spring Data, Spring Security) | Hibernate/JPA para persistencia.Experiencia en desarrollo de servicios RESTful y/o SOAP. Conocimientos en patrones de diseño (por ejemplo, MVC, Factory, Singleton).Experiencia en herramientas de testing como JUnit o Mockito.Gestión de APIs con Swagger/OpenAPI.Conocimientos en seguridad (autenticación/autorización con JWT, OAuth2).Conocimientos de mensajería (RabbitMQ, Kafka, JMS) y manejo de colas. AndroidExperiencia comprobada en el desarrollo de aplicaciones Android nativas.Dominio de Java y/o Kotlin.Conocimiento de los principios de diseño y las directrices de Material Design de Google.Experiencia trabajando con Android SDK y herramientas como Android Studio.Familiaridad con arquitecturas modernas como MVVM, MVP o Clean Architecture.Experiencia en la integración de APIs RESTful y uso de bibliotecas como Retrofit o Volley. Experiencia con bases de datos locales (SQLite, Room) y preferencias compartidas. Conocimientos básicos de seguridad en aplicaciones móviles (encriptación, almacenamiento seguro).Conocimientos básicos de Jetpack Compose para interfaces modernas.Base de DatosExperiencia con bases de datos relacionales (PostgreSQL, MySQL, Oracle).Conocimientos en bases de datos no relacionales (MongoDB, Redis).Capacidad para escribir consultas complejas en SQL.Optimización de consultas y diseño de bases de datos.DevOps y HerramientasExperiencia en Cloud AWS, sevicios EC2, ECS.Experiencia en contenedores y virtualización: Docker, Kubernetes.Conocimiento/experiencia(Deseable) en integracion/despliegue continuo con herramientas AWS, github pipelines (o similares)Experiencia con servidores de aplicaciones: WildFly, Tomcat, o similares.Uso de sistemas de control de versiones (Git, GitHub/GitLab/Bitbucket).CI/CD: Jenkins, GitHub ActionBeneficiosIngreso a planilla desde el primer día con todos los beneficios de ley.Actividades de integración y excelente clima laboral.Descuentos corporativos en una red de establecimientos de diversos rubros.Horario laboral: Lunes a viernes de 8:30 a.m. a 6:00 p.m. (2 días remoto)¿Estás listo para marcar la diferencia? Postula ahora y forma parte de un equipo que trabaja con pasión y propósito.",https://pe.linkedin.com/jobs/view/analista-programador-fullstack-at-kasnet-4313632322?position=7&pageNum=0&refId=ibvtIpBSpIoX5Bhd6o1mDw%3D%3D&trackingId=re5fkzhTbLt8Vb4SNeyoOg%3D%3D
Development Chapter Lead,La Positiva Seguros,https://pe.linkedin.com/company/la-positiva-seguros?trk=public_jobs_jserp-result_job-search-card-subtitle,"Lima, Peru",22 hours ago,,,"¡Transforma el rubro de los seguros como nuestro/a próximo/a Development Chapter Lead!Tu Reto será Liderar el capítulo de desarrollo dentro del CoE de Ingeniería de Software, asegurando la excelencia técnica, la adopción de buenas prácticas de ingeniería, la estandarización de lineamientos. Su propósito es elevar la calidad del software, garantizar la eficiencia en los procesos de desarrollo, y alinear las prácticas técnicas con la estrategia de transformación digital de la organización.Para lograrlo, te enfocarás en:Definir y actualizar continuamente las coding guidelines y estándares de calidad. Promover principios de Clean Code y Domain-Driven Design (DDD).Impulsar la adopción de nuevas tecnologías que aporten valor al negocio.Relevar el alcance funcional de proyectos y requerimientos y ser el responsable de la elaboración del documento funcional.Acompañar a los equipos de desarrollo en la resolución de problemas técnicos complejos.Participar en el diseño de arquitecturas y en la revisión de soluciones estratégicas.Asegurar que los proyectos cumplan con los lineamientos de calidad y seguridad definidos.Identificar brechas de conocimiento y proponer planes de capacitación.Destinar capacidad para realizar PoC con el fin de mejorar procesos y madurar el SDLC.Coordinar con Arquitectura, QA, Seguridad, y DevOSecOps para garantizar un SDLC integrado y eficiente.""Promover la integración de seguridad desde el inicio del SDLC (shift-left security).Asegurar la integración de escáneres de vulnerabilidades (SAST, DAST, SCA) en los pipelines.""Establecer reglas para revisiones de código (pull request policies, code owners, pair programming).Para este desafío, buscamos talentos con:Bachiller en Ingeniería de Sistemas de Información.Experiencia mínima de 5 años en desarrollo de software.Experiencia mínima de 3 años como Líder Técnico y/o 1 año como Chapter Lead realizando funciones similares.Manejo intermedio de: ORACLE y/o SQL Server, NET y/o JAVA, Cloud AWS, DevSecOps, React JS, React Native, Typescript.Manejo avanzado de iOS y/o Android.Manejo de Inglés intermedio.Experiencia en Seguros y/o Sector Financiero.Te proponemos:Unirte a una compañía peruana con respaldo internacional: Fidelidade, grupo asegurador europeo líder en el mercado.Desarrollarte y crecer profesionalmente en un equipo diverso e innovador.Trabajar con horarios flexibles que te permitan vivir en equilibrio.Crear juntos experiencias más simples y positivas para nuestros clientes y colaboradores.¿Estás listo/a? ¡Postula!La Positiva Seguros #AsíDeSimple",https://pe.linkedin.com/jobs/view/development-chapter-lead-at-la-positiva-seguros-4310780371?position=8&pageNum=0&refId=ibvtIpBSpIoX5Bhd6o1mDw%3D%3D&trackingId=MdqAzM4OTLhapQZ62t0Hvg%3D%3D
