Title job,Employer,Link profile employer,Location,How long ago,Recruiter,Profile recruiter,Description offer,Link offer
Tracking and QA Analyst,Launch Potato,https://www.linkedin.com/company/launchpotato?trk=public_jobs_jserp-result_job-search-card-subtitle,Lima Metropolitan Area,18 hours ago,,,"WHO ARE WE?Launch Potato is a profitable digital media company that reaches over 30M+ monthly visitors through brands such as FinanceBuzz, All About Cookies, and OnlyInYourState.As The Discovery and Conversion Company, our mission is to connect consumers with the world’s leading brands through data-driven content and technology.Headquartered in South Florida with a remote-first team spanning over 15 countries, we’ve built a high-growth, high-performance culture where speed, ownership, and measurable impact drive success.WHY JOIN US?At Launch Potato, you’ll accelerate your career by owning outcomes, moving fast, and driving impact with a global team of high-performers.CONTRACT NON-NEGOTIABLESYou’re available to work 40 hours per week, Monday - Friday. You’re comfortable working somewhere between 7:00 am to 6:00 pm Eastern Standard Time You have outstanding communication, presentation, and interpersonal skills and are fluent in English, both written and spokenYou're highly detail-oriented and reliableYou have excellent administrative skills with the ability to multitask and adapt in a fast-paced remote environment is requiredBASE SALARY: $1,500 - $2,500 (USD) per monthYOUR ROLEYou are a detail-oriented, results-driven professional with a passion for maintaining the highest standards of quality and efficiency in operational processes and procedures. Everything goes through QA, so you will be directly responsible for ensuring the success of our campaign launches which connects millions of consumers to our clients monthly! You will also be responsible for overseeing and optimizing our operations to ensure they meet and exceed industry standards and organizational objectives.Your unwavering attention to detail and thorough analysis skills will be invaluable in detecting and identifying potential problems within our daily operations. Additionally, you have a proven track record in quality management, process improvement, and possess industry-specific knowledge. Your ability to collaborate and work cross-functionally, leveraging your industry-specific expertise, will enable you to implement effective solutions, making a significant impact on our company's operational excellence.SUCCESS LOOKS LIKESupporting quality assurance for our financebuzz.com and allaboutcookies.org domainsMaintaining the currently implemented process for building, setting up, and testing tracking URLs across all campaigns and platforms to ensure the highest qualityReconciling reporting between our internal tracking platforms and external client platforms to ensure proper trackingConducting investigations when there is an offer discrepancy or malfunction and finding suitable resolutionsReviewing platform documentation and internal product setup to find areas of improvement and working with the Operations team to determine next steps to close the gapWorking closely with the Operations team to ensure QA standards are consistently met. Communicating with internal stakeholders on process improvementsAnalyzing ad hoc performance reports to improve company efficiency of revenue delivery, product improvement, or general site issuesMonitoring revenue, conversions, impressions, and clicks to ensure proper reporting when a new offer is created, links are changed, or in other necessary circumstancesMonitoring offer goals to ensure all goals are firing properly after creationEnsuring QA is successfully implemented with any new process that is rolled outQuickly becoming a subject matter expert for all QA related processesWhat You Need To Succeed2-3 years in operations or quality assurance and expertise in digital media advertising Exceptional attention to detailAbility to thrive in a fast-paced environmentUnderstanding of Postback URL tracking and other performance marketing methods of trackingExperience with Tune & Yieldspark or similar tracking toolsExperience with Asana or other project management toolsExperience with Looker or similar BI tools like Tableau or PowerBIProven abilities to analyze performance reports to improve company efficiency of revenue delivery, product improvement, or general site issuesProven problem solving abilities and #BetterEveryDay mindsetYou are proactive and will search for opportunities, not just being given tasks/ticketsExcellent organizational and communication skillsFluent in english, both written and verbalAbility to work East Coast hours consistentlyWant to accelerate your career? Apply now!Since day one, we've been committed to having a diverse, inclusive team and culture. We are proud to be an Equal Employment Opportunity company. We value diversity, equity, and inclusion.We do not discriminate based on race, religion, color, national origin, gender (including pregnancy, childbirth, or related medical conditions), sexual orientation, gender identity, gender expression, age, status as a protected veteran, status as an individual with a disability, or other applicable legally protected characteristics.",https://pe.linkedin.com/jobs/view/tracking-and-qa-analyst-at-launch-potato-4342701037?position=1&pageNum=0&refId=ZqNG5T%2B4ZQk5MvMEpYt7RQ%3D%3D&trackingId=Rm%2Bxp2PGlImCuigqBLVYJA%3D%3D
Digital Media QA Specialist,Launch Potato,https://www.linkedin.com/company/launchpotato?trk=public_jobs_jserp-result_job-search-card-subtitle,Lima Metropolitan Area,18 hours ago,,,"WHO ARE WE?Launch Potato is a profitable digital media company that reaches over 30M+ monthly visitors through brands such as FinanceBuzz, All About Cookies, and OnlyInYourState.As The Discovery and Conversion Company, our mission is to connect consumers with the world’s leading brands through data-driven content and technology.Headquartered in South Florida with a remote-first team spanning over 15 countries, we’ve built a high-growth, high-performance culture where speed, ownership, and measurable impact drive success.WHY JOIN US?At Launch Potato, you’ll accelerate your career by owning outcomes, moving fast, and driving impact with a global team of high-performers.CONTRACT NON-NEGOTIABLESYou’re available to work 40 hours per week, Monday - Friday. You’re comfortable working somewhere between 7:00 am to 6:00 pm Eastern Standard Time You have outstanding communication, presentation, and interpersonal skills and are fluent in English, both written and spokenYou're highly detail-oriented and reliableYou have excellent administrative skills with the ability to multitask and adapt in a fast-paced remote environment is requiredBASE SALARY: $1,500 - $2,500 (USD) per monthYOUR ROLEYou are a detail-oriented, results-driven professional with a passion for maintaining the highest standards of quality and efficiency in operational processes and procedures. Everything goes through QA, so you will be directly responsible for ensuring the success of our campaign launches which connects millions of consumers to our clients monthly! You will also be responsible for overseeing and optimizing our operations to ensure they meet and exceed industry standards and organizational objectives.Your unwavering attention to detail and thorough analysis skills will be invaluable in detecting and identifying potential problems within our daily operations. Additionally, you have a proven track record in quality management, process improvement, and possess industry-specific knowledge. Your ability to collaborate and work cross-functionally, leveraging your industry-specific expertise, will enable you to implement effective solutions, making a significant impact on our company's operational excellence.SUCCESS LOOKS LIKESupporting quality assurance for our financebuzz.com and allaboutcookies.org domainsMaintaining the currently implemented process for building, setting up, and testing tracking URLs across all campaigns and platforms to ensure the highest qualityReconciling reporting between our internal tracking platforms and external client platforms to ensure proper trackingConducting investigations when there is an offer discrepancy or malfunction and finding suitable resolutionsReviewing platform documentation and internal product setup to find areas of improvement and working with the Operations team to determine next steps to close the gapWorking closely with the Operations team to ensure QA standards are consistently met. Communicating with internal stakeholders on process improvementsAnalyzing ad hoc performance reports to improve company efficiency of revenue delivery, product improvement, or general site issuesMonitoring revenue, conversions, impressions, and clicks to ensure proper reporting when a new offer is created, links are changed, or in other necessary circumstancesMonitoring offer goals to ensure all goals are firing properly after creationEnsuring QA is successfully implemented with any new process that is rolled outQuickly becoming a subject matter expert for all QA related processesWhat You Need To Succeed2-3 years in operations or quality assurance and expertise in digital media advertising Exceptional attention to detailAbility to thrive in a fast-paced environmentUnderstanding of Postback URL tracking and other performance marketing methods of trackingExperience with Tune & Yieldspark or similar tracking toolsExperience with Asana or other project management toolsExperience with Looker or similar BI tools like Tableau or PowerBIProven abilities to analyze performance reports to improve company efficiency of revenue delivery, product improvement, or general site issuesProven problem solving abilities and #BetterEveryDay mindsetYou are proactive and will search for opportunities, not just being given tasks/ticketsExcellent organizational and communication skillsFluent in english, both written and verbalAbility to work East Coast hours consistentlyWant to accelerate your career? Apply now!Since day one, we've been committed to having a diverse, inclusive team and culture. We are proud to be an Equal Employment Opportunity company. We value diversity, equity, and inclusion.We do not discriminate based on race, religion, color, national origin, gender (including pregnancy, childbirth, or related medical conditions), sexual orientation, gender identity, gender expression, age, status as a protected veteran, status as an individual with a disability, or other applicable legally protected characteristics.",https://pe.linkedin.com/jobs/view/digital-media-qa-specialist-at-launch-potato-4342651229?position=2&pageNum=0&refId=ZqNG5T%2B4ZQk5MvMEpYt7RQ%3D%3D&trackingId=ekQjrI9XqPNHTuc6N%2BTTUg%3D%3D
Marketing Operations QA Specialist,Launch Potato,https://www.linkedin.com/company/launchpotato?trk=public_jobs_jserp-result_job-search-card-subtitle,Lima Metropolitan Area,18 hours ago,,,"WHO ARE WE?Launch Potato is a profitable digital media company that reaches over 30M+ monthly visitors through brands such as FinanceBuzz, All About Cookies, and OnlyInYourState.As The Discovery and Conversion Company, our mission is to connect consumers with the world’s leading brands through data-driven content and technology.Headquartered in South Florida with a remote-first team spanning over 15 countries, we’ve built a high-growth, high-performance culture where speed, ownership, and measurable impact drive success.WHY JOIN US?At Launch Potato, you’ll accelerate your career by owning outcomes, moving fast, and driving impact with a global team of high-performers.CONTRACT NON-NEGOTIABLESYou’re available to work 40 hours per week, Monday - Friday. You’re comfortable working somewhere between 7:00 am to 6:00 pm Eastern Standard Time You have outstanding communication, presentation, and interpersonal skills and are fluent in English, both written and spokenYou're highly detail-oriented and reliableYou have excellent administrative skills with the ability to multitask and adapt in a fast-paced remote environment is requiredBASE SALARY: $1,500 - $2,500 (USD) per monthYOUR ROLEYou are a detail-oriented, results-driven professional with a passion for maintaining the highest standards of quality and efficiency in operational processes and procedures. Everything goes through QA, so you will be directly responsible for ensuring the success of our campaign launches which connects millions of consumers to our clients monthly! You will also be responsible for overseeing and optimizing our operations to ensure they meet and exceed industry standards and organizational objectives.Your unwavering attention to detail and thorough analysis skills will be invaluable in detecting and identifying potential problems within our daily operations. Additionally, you have a proven track record in quality management, process improvement, and possess industry-specific knowledge. Your ability to collaborate and work cross-functionally, leveraging your industry-specific expertise, will enable you to implement effective solutions, making a significant impact on our company's operational excellence.SUCCESS LOOKS LIKESupporting quality assurance for our financebuzz.com and allaboutcookies.org domainsMaintaining the currently implemented process for building, setting up, and testing tracking URLs across all campaigns and platforms to ensure the highest qualityReconciling reporting between our internal tracking platforms and external client platforms to ensure proper trackingConducting investigations when there is an offer discrepancy or malfunction and finding suitable resolutionsReviewing platform documentation and internal product setup to find areas of improvement and working with the Operations team to determine next steps to close the gapWorking closely with the Operations team to ensure QA standards are consistently met. Communicating with internal stakeholders on process improvementsAnalyzing ad hoc performance reports to improve company efficiency of revenue delivery, product improvement, or general site issuesMonitoring revenue, conversions, impressions, and clicks to ensure proper reporting when a new offer is created, links are changed, or in other necessary circumstancesMonitoring offer goals to ensure all goals are firing properly after creationEnsuring QA is successfully implemented with any new process that is rolled outQuickly becoming a subject matter expert for all QA related processesWhat You Need To Succeed2-3 years in operations or quality assurance and expertise in digital media advertising Exceptional attention to detailAbility to thrive in a fast-paced environmentUnderstanding of Postback URL tracking and other performance marketing methods of trackingExperience with Tune & Yieldspark or similar tracking toolsExperience with Asana or other project management toolsExperience with Looker or similar BI tools like Tableau or PowerBIProven abilities to analyze performance reports to improve company efficiency of revenue delivery, product improvement, or general site issuesProven problem solving abilities and #BetterEveryDay mindsetYou are proactive and will search for opportunities, not just being given tasks/ticketsExcellent organizational and communication skillsFluent in english, both written and verbalAbility to work East Coast hours consistentlyWant to accelerate your career? Apply now!Since day one, we've been committed to having a diverse, inclusive team and culture. We are proud to be an Equal Employment Opportunity company. We value diversity, equity, and inclusion.We do not discriminate based on race, religion, color, national origin, gender (including pregnancy, childbirth, or related medical conditions), sexual orientation, gender identity, gender expression, age, status as a protected veteran, status as an individual with a disability, or other applicable legally protected characteristics.",https://pe.linkedin.com/jobs/view/marketing-operations-qa-specialist-at-launch-potato-4342651230?position=3&pageNum=0&refId=ZqNG5T%2B4ZQk5MvMEpYt7RQ%3D%3D&trackingId=0hlNAsYrRqm6TSI5SgBFHw%3D%3D
Campaign Performance and QA Analyst,Launch Potato,https://www.linkedin.com/company/launchpotato?trk=public_jobs_jserp-result_job-search-card-subtitle,Lima Metropolitan Area,18 hours ago,,,"WHO ARE WE?Launch Potato is a profitable digital media company that reaches over 30M+ monthly visitors through brands such as FinanceBuzz, All About Cookies, and OnlyInYourState.As The Discovery and Conversion Company, our mission is to connect consumers with the world’s leading brands through data-driven content and technology.Headquartered in South Florida with a remote-first team spanning over 15 countries, we’ve built a high-growth, high-performance culture where speed, ownership, and measurable impact drive success.WHY JOIN US?At Launch Potato, you’ll accelerate your career by owning outcomes, moving fast, and driving impact with a global team of high-performers.CONTRACT NON-NEGOTIABLESYou’re available to work 40 hours per week, Monday - Friday. You’re comfortable working somewhere between 7:00 am to 6:00 pm Eastern Standard Time You have outstanding communication, presentation, and interpersonal skills and are fluent in English, both written and spokenYou're highly detail-oriented and reliableYou have excellent administrative skills with the ability to multitask and adapt in a fast-paced remote environment is requiredBASE SALARY: $1,500 - $2,500 (USD) per monthYOUR ROLEYou are a detail-oriented, results-driven professional with a passion for maintaining the highest standards of quality and efficiency in operational processes and procedures. Everything goes through QA, so you will be directly responsible for ensuring the success of our campaign launches which connects millions of consumers to our clients monthly! You will also be responsible for overseeing and optimizing our operations to ensure they meet and exceed industry standards and organizational objectives.Your unwavering attention to detail and thorough analysis skills will be invaluable in detecting and identifying potential problems within our daily operations. Additionally, you have a proven track record in quality management, process improvement, and possess industry-specific knowledge. Your ability to collaborate and work cross-functionally, leveraging your industry-specific expertise, will enable you to implement effective solutions, making a significant impact on our company's operational excellence.SUCCESS LOOKS LIKESupporting quality assurance for our financebuzz.com and allaboutcookies.org domainsMaintaining the currently implemented process for building, setting up, and testing tracking URLs across all campaigns and platforms to ensure the highest qualityReconciling reporting between our internal tracking platforms and external client platforms to ensure proper trackingConducting investigations when there is an offer discrepancy or malfunction and finding suitable resolutionsReviewing platform documentation and internal product setup to find areas of improvement and working with the Operations team to determine next steps to close the gapWorking closely with the Operations team to ensure QA standards are consistently met. Communicating with internal stakeholders on process improvementsAnalyzing ad hoc performance reports to improve company efficiency of revenue delivery, product improvement, or general site issuesMonitoring revenue, conversions, impressions, and clicks to ensure proper reporting when a new offer is created, links are changed, or in other necessary circumstancesMonitoring offer goals to ensure all goals are firing properly after creationEnsuring QA is successfully implemented with any new process that is rolled outQuickly becoming a subject matter expert for all QA related processesWhat You Need To Succeed2-3 years in operations or quality assurance and expertise in digital media advertising Exceptional attention to detailAbility to thrive in a fast-paced environmentUnderstanding of Postback URL tracking and other performance marketing methods of trackingExperience with Tune & Yieldspark or similar tracking toolsExperience with Asana or other project management toolsExperience with Looker or similar BI tools like Tableau or PowerBIProven abilities to analyze performance reports to improve company efficiency of revenue delivery, product improvement, or general site issuesProven problem solving abilities and #BetterEveryDay mindsetYou are proactive and will search for opportunities, not just being given tasks/ticketsExcellent organizational and communication skillsFluent in english, both written and verbalAbility to work East Coast hours consistentlyWant to accelerate your career? Apply now!Since day one, we've been committed to having a diverse, inclusive team and culture. We are proud to be an Equal Employment Opportunity company. We value diversity, equity, and inclusion.We do not discriminate based on race, religion, color, national origin, gender (including pregnancy, childbirth, or related medical conditions), sexual orientation, gender identity, gender expression, age, status as a protected veteran, status as an individual with a disability, or other applicable legally protected characteristics.",https://pe.linkedin.com/jobs/view/campaign-performance-and-qa-analyst-at-launch-potato-4342711006?position=4&pageNum=0&refId=ZqNG5T%2B4ZQk5MvMEpYt7RQ%3D%3D&trackingId=y4esKmc%2FwABEomUusHYZYg%3D%3D
Analista Funcional - Seguros,UniversityClass Business School,https://cl.linkedin.com/company/universityclass?trk=public_jobs_jserp-result_job-search-card-subtitle,"Lima, Peru",8 hours ago,,,,https://pe.linkedin.com/jobs/view/analista-funcional-seguros-at-universityclass-business-school-4348953031?position=5&pageNum=0&refId=ZqNG5T%2B4ZQk5MvMEpYt7RQ%3D%3D&trackingId=89Q5wUrZEuXiNi3a8c9MIA%3D%3D
Ingeniero DevOps,METRICA Perú,https://pe.linkedin.com/company/metricaperusac?trk=public_jobs_jserp-result_job-search-card-subtitle,"Lima, Peru",10 hours ago,Manuel Rodriguez Romero,https://pe.linkedin.com/in/manuel-rodriguez-romero-43bb7618a,"Métrica Perú es la primera filial latinoamericana del grupo de consultoría español Métrica Consulting. El grupo comenzó operaciones con el inicio del nuevo siglo y desde entonces ha participado en distintos proyectos en distintos países de Europa Occidental y Latino América. Con Métrica Andina, hemos comenzado a ofrecer nuestros servicios técnicos en el mercado Peruano y desde ahí queremos llegar a la región andina en los próximos años.En Métrica Perú estamos en la búsqueda de un Ingeniero Devops para unirse a nuestro equipo en Lima, Peru. Si eres una persona apasionada por la tecnología y la innovación, con experiencia en entornos de desarrollo y operaciones, ¡esta posición es para ti!Si te apasiona la tecnología, la mejora continua y buscas un desafío que te permita crecer profesionalmente, ¡te estamos esperando en Métrica Perú!Requisitos:Implementar y mantener pipelines CI/CD (Jenkins, GitHub Actions, Bitbucket).Automatizar despliegues en entornos dev/QA/producción.Gestionar contenedores y orquestación (Docker, Kubernetes).Automatizar infraestructura con Ansible y Terraform.Beneficios:Proyecto de gran alcance nacional.Planilla desde el primer día con todos los beneficios acorde a ley.Remuneración fija superior al mercado.Seguro Vida Ley y EPS (Opcional)Participar de un programa de reconocimiento.Buen clima laboralConvenios educativos, descuentos en centros comerciales, recreativos, etc.Pertenecer a una prestigiosa empresa de tecnología y generar lazos transnacionales.En Métrica Andina estamos comprometidos con la inclusión, diversidad y equidad de género. Por ello, los procesos de selección buscan asegurar la igualdad de derechos y oportunidades.¡Si estás listo para dar el siguiente paso en tu carrera y te apasiona la tecnología, esta es tu oportunidad!.#ChambeaenMétrica",https://pe.linkedin.com/jobs/view/ingeniero-devops-at-metrica-per%C3%BA-4342623668?position=6&pageNum=0&refId=ZqNG5T%2B4ZQk5MvMEpYt7RQ%3D%3D&trackingId=donsdLpdPbz48OI%2BC53SbA%3D%3D
