Title job,Employer,Link profile employer,Location,How long ago,Recruiter,Profile recruiter,Description offer,Link offer
Analista QA Junior,Valtx Perú,https://pe.linkedin.com/company/valtx-peru?trk=public_jobs_jserp-result_job-search-card-subtitle,"San Isidro, Peru",9 hours ago,Tomasita Chauca vela,https://pe.linkedin.com/in/tomasita-chauca-vela-330427122,"En Valtx, empresa con 25 años de experiencia en el mercado peruano, cuyo objetivo principal es convertirse en un socio estratégico, mediante soluciones tecnológicas en los diversos aspectos de los procesos de negocios; el desarrollo, implementación y mantenimiento de aplicaciones e infraestructura tecnológica para el negocio; y consultoría en diversos procesos de transformación, nos encontramos en la búsqueda de un Analista QA Junior .¿Qué requisitos necesito?2+ años en la ejecución de pruebas core bancarioPruebas QA en cajeros DNSeriesTesting Funcional, Integración, Regresión y UAT.Diseño y ejecución de casos de prueba manuales y automatizados.Gestión y seguimiento de incidencias y defectos.Bases de datos: SQL y Oracle.Metodologías ágiles: Scrum.Ingeniería de Requerimientos.Técnicas de estimación de esfuerzo.Modelamiento y análisis de procesos.Gestión de Servicios TI (IT Service Management).Plataformas bancarias: BanTotal (BT) y AS400.Herramientas de gestión y seguimiento de proyectos ágiles.Análisis funcional y validación de reglas de negocio.Elaboración de documentación funcional y de pruebas.Principales funciones del puesto:Ejecución de pruebas QA en cajeros automáticos DN Series durante el proyecto de actualización a Windows 10 2021.Diseño y ejecución de pruebas funcionales, integración y regresión para validar la estabilidad y operatividad de los cajeros.Validación de transacciones financieras, dispositivos periféricos y funcionalidades críticas del canal ATM.Diseño, creación y ejecución de casos de prueba manuales y automatizados para validar funcionalidades y asegurar la calidad del software.Gestión, seguimiento y análisis de incidencias y defectos durante el ciclo de pruebas.Validación de datos mediante consultas en bases de datos SQL y Oracle, garantizando la integridad de la información.Participación en equipos ágiles bajo metodología Scrum, colaborando en la gestión de requerimientos y definición de criterios de aceptación.Análisis y modelamiento de procesos de negocio, identificando oportunidades de mejora y riesgos funcionales.Estimación de esfuerzos de pruebas y soporte en la planificación de actividades del proyecto.Validación funcional de aplicaciones y plataformas bancarias (BanTotal y AS400).Se valora:Experiencia en Automatización: Selenium, Appium, Cypress, Katalon Studio.Pruebas de rendimiento/Seguridad: JMeter, SonarQube, OwasZAP, BurpSuite.Gestión de pruebas: JIRA.Consumo de APIs: Postman, SoapUI, Swagger.",https://pe.linkedin.com/jobs/view/analista-qa-junior-at-valtx-per%C3%BA-4430733064?position=1&pageNum=0&refId=ai3eXcihVtMOqxrW3Mi%2FQw%3D%3D&trackingId=omvCU5uJ4beYjfUQlo61pQ%3D%3D
QA Automation Engineer | Mobile,Entelgy,https://es.linkedin.com/company/entelgy?trk=public_jobs_jserp-result_job-search-card-subtitle,"Lima, Peru",12 hours ago,Sandra Ruiz Flores,https://es.linkedin.com/in/sandraruizflores,"DÉJANOS CONTARTE LO QUE NOS HACE GENUINEBuscamos profesionales que quieran reinventarse cada día, que enfrentarse a los retos vaya en su ADN y que sientan pasión por trabajar con la tecnología. Esto nos hace únicos, diferentes y auténticos.¿QUÉ ESTAMOS BUSCANDO?Buscamos un Analista QA Automatizador y será responsable de diseñar, desarrollar y mantener soluciones de automatización de pruebas, asegurando la calidad de aplicaciones móviles, web y APIs, así como la correcta integración entre diferentes sistemas y servicios.Funciones:Desarrollar y ejecutar automatización de pruebas para aplicaciones móviles, web y APIs.Automatizar pruebas de APIs y eventos (Event Testing).Diseñar y ejecutar pruebas de Contract Testing.Implementar pruebas utilizando herramientas de Mocking, Service Virtualization y Microcks.Ejecutar pruebas de trazabilidad End to End (E2E).Realizar pruebas de performance utilizando K6.Ejecutar pruebas de interoperabilidad entre entidades financieras.Automatizar pruebas sobre aplicaciones móviles (70%), web (20%) y APIs (10%).Validar integraciones sobre GCP utilizando Pub/Sub, Cloud Run y Apigee.Participar en la implementación y mantenimiento de frameworks de automatización.Gestionar la ejecución de pruebas automatizadas mediante procesos de integración y despliegue continuo (CI/CD).Administrar el versionamiento del código utilizando Git.Requisitos:Profesional egresado de Ingeniería de Sistemas, Informática o carreras afines.Experiencia en automatización de pruebas para aplicaciones móviles, web y APIs.Experiencia en automatización de APIs y Event Testing.Conocimiento y experiencia en Karate, Appium, Python, Rest Assured y Postman.Experiencia en Contract Testing.Conocimientos en Mocking, Service Virtualization y Microcks.Experiencia en pruebas de trazabilidad End to End (E2E).Experiencia en pruebas de performance utilizando K6.Experiencia en pruebas de interoperabilidad entre entidades financieras.Conocimientos en GCP (Pub/Sub, Cloud Run y Apigee).Conocimientos sólidos de Selenium, localizadores (XPath), esperas implícitas y explícitas, Selenium Grid y ejecución de pruebas Headless.Conocimientos en Programación Orientada a Objetos (Herencia y Encapsulamiento).Conocimiento de BDD y TDD, así como de la estructura de archivos .feature.Experiencia utilizando Git (Merge, Rebase, Pull Request, Git Pull y Git Ignore).Conocimientos en CI/CD, pipelines de integración continua, pipelines parametrizados y despliegue continuo.Experiencia en Docker para la ejecución de automatizaciones.Experiencia diseñando frameworks de automatización escalables, manejo de datos de prueba, patrones POM y Screenplay, y buenas prácticas para evitar duplicidad de código.PORQUE EN ENTELGY TODO COMIENZA CONTIGOÚnicos, Reales, Auténticos, Diferentes……Somos 100% GENUINE.Nuestra cultura se vive en el día a día, somos como una gran familia y formamos Entelgy Family, donde podrás participar en diferentes actividades, eventos, retos y mucho más. También tenemos un conjunto de iniciativas orientadas a potenciar que tengas una vida sana y equilibrada, nuestro compromiso de contribuir a nuestra sociedad con iniciativas para el Cuidado del medio ambiente, Voluntariado comunitario, Sensibilización sobre personas vulnerables, etc. Health & Wellness, Responsabilidad Social, Programa para el Cuidado del Medio Ambiente.ASÍ ES COMO PONEMOS TODO NUESTRO TALENTO EN POTENCIAR EL TUYOVen para formar parte de nuestro equipo, y descubre que no es sólo lo que hacemos, sino cómo lo hacemos. ¡Atrévete a vivir una experiencia Genuine!Proyectos retadores para grandes clientes: Trabajarás en proyectos de gran relevancia para nuestros clientes, junto a un gran equipo de profesionales desde el primer día.Un progreso acelerado: Tu crecimiento estará garantizado y potenciado. Vamos contigo en lo que necesites.",https://pe.linkedin.com/jobs/view/qa-automation-engineer-mobile-at-entelgy-4429356103?position=2&pageNum=0&refId=ai3eXcihVtMOqxrW3Mi%2FQw%3D%3D&trackingId=LSyix%2B8bOS9EgYiSoEa%2F8w%3D%3D
Ingeniero Senior de Automatización de Aseguramiento de Calidad,Coforge,https://in.linkedin.com/company/coforge-tech?trk=public_jobs_jserp-result_job-search-card-subtitle,"Lima, Peru",14 hours ago,Ronald Huari,https://pe.linkedin.com/in/ronaldhuari,"Título del puesto: Senior QA Automation EngineerHabilidades clave: QA Automation, APIs Testing, Karate Framework, Java, Python, AWS Lambda, Appium, Performance Testing, Observability, SQL, MySQL, MongoDB, DynamoDB, BigQuery, SonarQube, GitHub, Jira, Xray, BDD (Cucumber/Gherkin), CI/CD y experiencia en banca y servicios financieros.Experiencia: +5 años de experiencia en QA con sólida base técnica en pruebas funcionales, automatización, performance testing y observabilidad.Ubicación: Lima, Perú.Modalidad: Híbrida.Responsabilidades principalesDiseñar y mantener soluciones de automatización para pruebas web, APIs y mobile utilizando Karate Framework, Java y Appium.Ejecutar pruebas funcionales, técnicas, de regresión, performance (carga, estrés, resistencia y escalabilidad) y seguridad.Validar componentes desarrollados en Python, servicios AWS Lambda y datos en SQL, MySQL, MongoDB, DynamoDB y BigQuery.Integrar automatización y controles de calidad en pipelines CI/CD utilizando GitHub y SonarQube.Monitorear métricas de observabilidad, gestionar pruebas mediante Jira y Xray, y brindar soporte durante procesos UAT.Colaborar con equipos de Desarrollo, Arquitectura, DevOps y Producto para garantizar la calidad end-to-end de las soluciones.Requisitos indispensablesBachiller o titulado en Ingeniería de Sistemas, Software o carreras afines.Más de 5 años de experiencia en QA, preferentemente en banca, servicios financieros o medios de pago.Experiencia en automatización de APIs con Karate Framework y Java.Conocimientos de Python, AWS Lambda y servicios cloud.Experiencia en automatización mobile con Appium.Manejo de bases de datos SQL y NoSQL (MySQL, MongoDB, DynamoDB) y validaciones en BigQuery.Experiencia en pruebas de performance: carga, estrés, resistencia y escalabilidad.Conocimientos de observabilidad, análisis estático de código (SonarQube), GitHub, CI/CD, Jira, Xray y BDD (Cucumber/Gherkin).Publicado el: 18-06-2026En Coforge, contratamos profesionales únicamente en función de sus habilidades y calificaciones, y no discriminamos en función de la edad, discapacidad, religión, género, orientación sexual, estado socioeconómico o nacionalidad.",https://pe.linkedin.com/jobs/view/ingeniero-senior-de-automatizaci%C3%B3n-de-aseguramiento-de-calidad-at-coforge-4429317383?position=3&pageNum=0&refId=ai3eXcihVtMOqxrW3Mi%2FQw%3D%3D&trackingId=WIVln3OTEH2H%2F4lrEv0Hwg%3D%3D
QA Automation Sr Playwright,METRICA Perú,https://pe.linkedin.com/company/metricaperusac?trk=public_jobs_jserp-result_job-search-card-subtitle,"Lima, Peru",7 hours ago,Miguel Vilchez,https://pe.linkedin.com/in/miguel-vilchez,"🚀 ¡Sé parte de METRICA!METRICA es una multinacional tecnológica con más de 25 años de experiencia, especializada en consultoría, outsourcing y desarrollo de soluciones que impulsan la transformación digital de organizaciones a nivel global.Actualmente buscamos incorporar a nuestro equipo un:💻 QA Automation Engineer Senior💡 Lo que harás en este rolDiseñar y mantener soluciones de automatización de pruebas para aplicaciones web y APIs utilizando Playwright.Implementar pruebas funcionales, de regresión, integración y End-to-End (E2E), asegurando la calidad de los productos digitales.Participar en la definición de criterios de aceptación, diseño de escenarios BDD/Gherkin e integración de pruebas dentro de pipelines CI/CD.Colaborar con equipos de Desarrollo y DevOps para promover buenas prácticas de calidad, automatización y mejora continua.🎯 Lo que esperamos de tiFormación en Ingeniería de Sistemas, Informática, Computación o carreras afines.Mínimo 5 años de experiencia en QA Automation.Experiencia sólida con Playwright y dominio de JavaScript y/o TypeScript.Experiencia automatizando pruebas web y APIs, así como construyendo frameworks escalables y mantenibles.Conocimientos de Jira, Xray, Git, metodologías ágiles y herramientas de integración continua como Jenkins, GitHub Actions o Azure DevOps.⭐ DeseableExperiencia con Karate DSL, Serenity BDD o Rest Assured.Conocimientos de OWASP, SonarQube, observabilidad, bases de datos y certificación ISTQB.Experiencia en entornos DevOps o DevSecOps.🎁 Lo que ofrecemosPlanilla con todos los beneficios de ley.Participación en proyectos de transformación digital de alto impacto.Capacitación continua, crecimiento profesional y excelente ambiente laboral.🌱 Nuestro compromisoEn METRICA promovemos la igualdad de oportunidades y la no discriminación en todos nuestros procesos. Esta convocatoria también está dirigida a personas con discapacidad, en cumplimiento de la Ley N.° 29973.",https://pe.linkedin.com/jobs/view/qa-automation-sr-playwright-at-metrica-per%C3%BA-4430757002?position=4&pageNum=0&refId=ai3eXcihVtMOqxrW3Mi%2FQw%3D%3D&trackingId=cf8fdLLkegX7MXnQX17oIA%3D%3D
Asesor de Ventas Bilingue,Solvo Global Careers,https://co.linkedin.com/company/solvo-global-careers?trk=public_jobs_jserp-result_job-search-card-subtitle,"Lima, Peru",9 hours ago,Juan Sebastian Avellaneda Mazzo,https://co.linkedin.com/in/juan-sebastian-avellaneda-mazzo,"Especialista en Generación de Leads / Soporte Comercial (B2B)📌 Perfil que buscamosEstamos en búsqueda de perfiles con experiencia en atención al cliente y enfoque comercial, que quieran desarrollarse en un entorno orientado a resultados.✅Experiencia requerida:Mínimo 1 año de experiencia como CSR (Customer Service Representative)Se aceptan perfiles que hayan sido promovidos a Supervisor, Team Lead o QA🔥 Plus: 1 año de experiencia en entornos B2B🌐 Idioma:Inglés B2+ / C1 (avanzado)🧰 Herramientas:Experiencia con CRM (preferiblemente Salesforce)No es un requisito excluyente → puede ser cualquier CRM, especialmente en contextos de ventas⏰ Lugar y HorarioLima, Perú - ON SITELunes a viernes | 8:00 AM – 6:00 PM🧩 ResponsabilidadesInvestigar prospectos y recopilar información utilizando navegadores web, sitios de empresas y recursos de datos internosDepurar y calificar leads para asegurar su calidadGestionar y mantener actualizada la información en el CRMContactar prospectos para obtener y validar informaciónMantener registros precisos de interacciones y gestionar múltiples leads simultáneamenteColaborar con el equipo para compartir mejores prácticasApoyar en la implementación de estrategias comerciales para mejorar la generación y conversión de leadsBrindar soporte administrativo al equipo de ventas (agenda, reportes, etc.)Monitorear y analizar métricas para identificar oportunidades de mejora",https://pe.linkedin.com/jobs/view/asesor-de-ventas-bilingue-at-solvo-global-careers-4427859874?position=5&pageNum=0&refId=ai3eXcihVtMOqxrW3Mi%2FQw%3D%3D&trackingId=fiMGd00RAcIeWUunTfObEQ%3D%3D
