Title job,Employer,Link profile employer,Location,How long ago,Recruiter,Profile recruiter,Description offer,Link offer
CONTROL DOCUMENTARIO,Yokogawa,https://jp.linkedin.com/company/yokogawa?trk=public_jobs_jserp-result_job-search-card-subtitle,"Lima, Peru",6 hours ago,,,"Not just a job, but a careerYokogawa, award winner for ‘Best Asset Monitoring Technology’ and ‘Best Digital Twin Technology’ at the HP Awards, is a leading provider of industrial automation, test and measurement, information systems and industrial services in several industries.Our aim is to shape a better future for our planet through supporting the energy transition, (bio)technology, artificial intelligence, industrial cybersecurity, etc. We are committed to the United Nations sustainable development goals by utilizing our ability to measure and connect.About The TeamOur 18,000 employees work in over 60 countries with one corporate mission, to ""co-innovate tomorrow"". We are looking for dynamic colleagues who share our passion for technology and care for our planet. In return, we offer you great career opportunities to grow yourself in a truly global culture where respect, value creation, collaboration, integrity, and gratitude are highly valued and exhibited in everything we do.Sobre nosotrosEl grupo Yokogawa, fundado en 1915 en Tokio, es actualmente líder mundial en el suministro de soluciones integradas de control de procesos. Y continuamos desarrollando y ofreciendo tecnología de punta, dentro del concepto ETS - Enterprise Technology Solutions -, que significa presentar la solución global al cliente, para el mejor costo/beneficio.Nuestro know-how internacional está certificado ISO:9001 y está a disposición de nuestros clientes, en toda su área de actividad, en relación con la optimización de la producción, los activos y la cadena de suministro con la aplicación efectiva de tecnologías digitales, permitiendo la transición hacia operaciones autónomas.En más de un siglo de historia, Yokogawa continúa trabajando por una sociedad sostenible a través de sus más de 17.000 empleados en una red global de 122 empresas que abarcan 61 países.Posición: CONTROL DOCUMENTARIORequisitos académicos:Ingeniero titulado en la especialidad de Mecánica, Mecánica Eléctrica, Industrial, Mecatrónica, Electrónica o Electricidad.Titulado / Colegiatura habilitada vigente.La acreditación será a través de copias de títulos y/o certificados académicos y certificado de habilidad CIP.Experiencia requerida:Experiencia acreditada acumulada mínima de 03 años en funciones relacionadas a trabajos como Controlador de Documentos o Asistente de Control Documentario en proyectos industriales, preferentemente en paradas de planta del sector Oíl & Gas. en empresas industriales o entidades privadas o públicas, de preferencia del sector energía, minas, hidrocarburos o afines.Experiencia previa en paradas de planta, con conocimiento del flujo documental típico en mantenimiento mayor.La acreditación será a través de certificados de trabajo y/o constancias de trabajo.Responsabilidades:Registrar, clasificar, codificar y archivar toda la documentación técnica generada durante la parada de planta (órdenes de trabajo, informes, procedimientos, planos, hojas de datos, permisos, etc.).Asegurar el control de versiones y la trazabilidad de documentos durante el ciclo de vida del proyecto.Difundir la documentación aprobada a los responsables de área (supervisión, ingeniería, HSE, QA/QC, contratistas).Controlar el flujo de entrega y recepción de documentos entre contratistas, supervisores y el cliente.Gestionar matrices de seguimiento documental y reportes diarios/semanales.Resguardar los documentos conforme a los lineamientos del SGI (Sistema de Gestión Integrado).Apoyar en la organización y cierre documental del proyecto, tanto en formato físico como digital.Cumplir con los lineamientos de confidencialidad, integridad y disponibilidad de la información.Conocimientos específicos:Gestión documental, manejo de bases de datos y sistemas de control de documentos.Gestión de documentos técnicos bajo normas ISO 9001 y 14001.Codificación documental (document control matrix, work packs, RFI, NCR, etc.).Manejo de plataformas digitales para el control documental (SharePoint, Microsoft Teams, Dropbox Business, Aconex, SAP DMS, entre otros).Conocimiento básico de lectura de planos, diagramas de tuberías e instrumentación (P&ID), cronogramas y reportes de avance.Dominio intermedio / Avanzado de Microsoft Office (Excel, Word, Outlook, PowerPoint, Project).Elaboración de matrices de correspondencia, actas y transmittals.Gestión de backups, digitalización y control de archivos físicos.Competencias claves:Organización y atención al detalle. Manejo de tiempos y cumplimiento de plazos. Confidencialidad y ética profesional.Capacidad para trabajar bajo presión y en entornos dinámicos.Comunicación efectiva y relaciones interpersonales. Proactividad y orientación al servicio. Capacidad de trabajo colaborativo con equipos multidisciplinarios.Yokogawa quiere una cultura diversa, equitativa e inclusiva. Reclutaremos, desarrollaremos y promoveremos activamente a personas de diversos orígenes que difieren en términos de experiencia, conocimiento, estilos de pensamiento, perspectiva, antecedentes culturales y estatus socioeconómico. No discriminaremos por motivos de raza, color de piel, edad, sexo, identidad y expresión de género, orientación sexual, religión, creencias, opinión política, nacionalidad, etnia, lugar de origen, discapacidad, relaciones familiares o cualquier otra circunstancia. Yokogawa valora las diferencias y permite que todos pertenezcan, contribuyan, triunfen y demuestren todo su potencial.Al postularse para este puesto, usted reconoce y acepta que Yokogawa podrá recopilar, utilizar y procesar sus datos personales con el fin de gestionar el proceso de selección. Esto incluye evaluar su idoneidad para el cargo anunciado y realizar los trámites administrativos correspondientes.Asimismo, cuando sea necesario, sus datos podrán ser compartidos con proveedores de servicios externos autorizados, con el propósito de llevar a cabo las verificaciones necesarias y asegurar el cumplimiento de los requisitos legales y normativos aplicables.Yokogawa se compromete a proteger su privacidad, manejando sus datos personales bajo estrictos estándares de seguridad y confidencialidad. Al continuar con su solicitud, usted confirma haber leído, comprendido y aceptado esta declaración, otorgando su consentimiento para la recopilación, uso, divulgación y procesamiento de sus datos personales conforme a lo aquí establecido.Yokogawa is an Equal Opportunity Employer. Yokogawa wants a diverse, equitable and inclusive culture. We will actively recruit, develop, and promote people from a variety of backgrounds who differ in terms of experience, knowledge, thinking styles, perspective, cultural background, and socioeconomic status. We will not discriminate based on race, skin color, age, sex, gender identity and expression, sexual orientation, religion, belief, political opinion, nationality, ethnicity, place of origin, disability, family relations or any other circumstances. Yokogawa values differences and enables everyone to belong, contribute, succeed, and demonstrate their full potential.Are you being referred to one of our roles? If so, ask your connection at Yokogawaabout our Employee Referral process!",https://pe.linkedin.com/jobs/view/control-documentario-at-yokogawa-4403119641?position=1&pageNum=0&refId=VL4fekJd%2Fy6AmP%2Bgg8xUoQ%3D%3D&trackingId=Ft0bGx%2F7CQryU16%2B8xxOoA%3D%3D
Analista QA Funcional,Entelgy,https://es.linkedin.com/company/entelgy?trk=public_jobs_jserp-result_job-search-card-subtitle,"Lima, Peru",22 hours ago,Sandra Ruiz Flores,https://pe.linkedin.com/in/sandraruizflores,"💡 DÉJANOS CONTARTE LO QUE NOS HACE GENUINE 💙Buscamos profesionales que quieran reinventarse cada día 🔄, que lleven los retos en el ADN 🧬 y que sientan una pasión genuina por la tecnología 💻✨.Eso es lo que nos hace únicos, auténticos y diferentes 🚀.¿QUÉ ESTAMOS BUSCANDO?Garantizar la calidad de los sistemas mediante el diseño, ejecución y documentación de pruebas funcionales y de servicios, asegurando el cumplimiento de los requerimientos y flujos de negocio.Funciones:Analizar requerimientos funcionales y técnicos para identificar escenarios de prueba.Diseñar, documentar y ejecutar casos de prueba funcionales.Ejecutar pruebas manuales en aplicaciones web y/o móviles.Realizar pruebas de servicios (APIs REST), incluyendo:Validación de métodos HTTP (GET, POST, PUT, DELETE).Verificación de códigos de respuesta, headers y payloads.Validación de reglas de negocio y manejo de errores.Identificar, registrar y dar seguimiento a defectos/incidencias en herramientas de gestión.Ejecutar pruebas de regresión y apoyar en pruebas de integración.Participar en ceremonias ágiles (daily, refinement, planning).Colaborar con desarrolladores, Product Owners y stakeholders para asegurar la calidad del producto.Validar datos mediante consultas básicas en base de datos (SQL).Analizar requerimientos funcionales y técnicos para identificar escenarios de prueba.Diseñar, documentar y ejecutar casos de prueba funcionales.Ejecutar pruebas manuales en aplicaciones web y/o móviles.Realizar pruebas de servicios (APIs REST), incluyendo:Validación de métodos HTTP (GET, POST, PUT, DELETE).Verificación de códigos de respuesta, headers y payloads.Validación de reglas de negocio y manejo de errores.Identificar, registrar y dar seguimiento a defectos/incidencias en herramientas de gestión.Ejecutar pruebas de regresión y apoyar en pruebas de integración.Participar en ceremonias ágiles (daily, refinement, planning).Colaborar con desarrolladores, Product Owners y stakeholders para asegurar la calidad del producto.Validar datos mediante consultas básicas en base de datos (SQL).Requisitos:.Profesional en Ingeniería de Sistemas, Software o carreras afines.3 años de experiencia comprobada como QA Funcional Experiencia en pruebas manuales funcionales.Experiencia en pruebas de servicios / APIs REST.Experiencia trabajando en entornos ágiles (Scrum o Kanban).Conocimiento en pruebas funcionales manuales.Conocimiento en pruebas de APIs (Postman, SoapUI).Manejo de estructuras JSON.Validación de respuestas (status codes, payloads, headers).Herramientas de gestión de incidencias:JiraAzure DevOps u otrasConocimientos básicos de SQL para validación de datos.Postman / SoapUIJira / Azure DevOpsTestRail, Zephyr o Xray (gestión de pruebas)Git (básico)Experiencia en pruebas de integración o UAT.(Deseable)Conocimientos iniciales en automatización de pruebas.(Deseable)Buen entendimiento del ciclo de vida de pruebas (STLC).(Deseable)PORQUE EN ENTELGY TODO COMIENZA CONTIGOÚnicos, Reales, Auténticos, Diferentes……Somos 100% GENUINE.Nuestra cultura se vive en el día a día, somos como una gran familia y formamos Entelgy Family, donde podrás participar en diferentes actividades, eventos, retos y mucho más. También tenemos un conjunto de iniciativas orientadas a potenciar que tengas una vida sana y equilibrada, nuestro compromiso de contribuir a nuestra sociedad con iniciativas para el Cuidado del medio ambiente, Voluntariado comunitario, Sensibilización sobre personas vulnerables, etc. Health & Wellness, Responsabilidad Social, Programa para el Cuidado del Medio Ambiente.ASÍ ES COMO PONEMOS TODO NUESTRO TALENTO EN POTENCIAR EL TUYOVen para formar parte de nuestro equipo, y descubre que no es sólo lo que hacemos, sino cómo lo hacemos. ¡Atrévete a vivir una experiencia Genuine!Proyectos retadores para grandes clientes: Trabajarás en proyectos de gran relevancia para nuestros clientes, junto a un gran equipo de profesionales desde el primer día.Un progreso acelerado: Tu crecimiento estará garantizado y potenciado. Vamos contigo en lo que necesites.¡Atrévete a vivir una experiencia Genuine!",https://pe.linkedin.com/jobs/view/analista-qa-funcional-at-entelgy-4401847489?position=2&pageNum=0&refId=VL4fekJd%2Fy6AmP%2Bgg8xUoQ%3D%3D&trackingId=wdZmv8QmKrORP9UPCRQ3kw%3D%3D
QA Automation Engineer,Encora Inc.,https://www.linkedin.com/company/encorainc?trk=public_jobs_jserp-result_job-search-card-subtitle,"Lima, Peru",4 hours ago,,,"Información ImportanteUbicación: PerúModalidad de trabajo: HíbridoResumen del RolBuscamos un QA Automation Engineer (20749), responsable de asegurar la calidad del software mediante la automatización de pruebas y la implementación de buenas prácticas de testing. Trabajarás en conjunto con equipos de desarrollo y producto para garantizar soluciones confiables, eficientes y alineadas a los objetivos del negocio.Responsabilidades y FuncionesDiseñar, desarrollar y mantener pruebas automatizadas.Implementar y mejorar frameworks de automatización de testing.Identificar, documentar y dar seguimiento a defectos.Ejecutar pruebas funcionales, de integración y regresión.Colaborar con equipos de desarrollo para asegurar la calidad desde etapas tempranas.Integrar pruebas dentro de pipelines CI/CD.Promover buenas prácticas de QA y mejora continua en procesos de testing.Participar en ceremonias ágiles y actividades del equipo.Requisitos y HabilidadesExperiencia en automatización de pruebas de software.Conocimiento de herramientas como Selenium, Cypress u otras similares.Experiencia en desarrollo de scripts de automatización.Conocimiento del ciclo de vida de desarrollo de software (SDLC).Experiencia en integración de pruebas en CI/CD.Experiencia trabajando en entornos ágiles.Habilidades analíticas, atención al detalle y trabajo en equipo.Sobre EncoraEncora es el socio preferido para ingeniería digital y modernización de algunas de las empresas líderes del mundo y compañías digitales nativas. Con más de 9,000 expertos en más de 47 oficinas y laboratorios de innovación a nivel global, Encora ofrece soluciones en Product Engineering, Cloud Services, Quality Engineering, DevSecOps, Data, Digital Experience, Cybersecurity y AI Engineering.En Encora contratamos profesionales basándonos únicamente en sus habilidades y calificaciones, sin discriminación por edad, discapacidad, religión, género, orientación sexual, condición socioeconómica o nacionalidad.",https://pe.linkedin.com/jobs/view/qa-automation-engineer-at-encora-inc-4403138455?position=3&pageNum=0&refId=VL4fekJd%2Fy6AmP%2Bgg8xUoQ%3D%3D&trackingId=ylhyn80FfcLVslkd3WnL3g%3D%3D
SUPERVISOR QA/QC,Yokogawa,https://jp.linkedin.com/company/yokogawa?trk=public_jobs_jserp-result_job-search-card-subtitle,"Lima, Peru",6 hours ago,,,"Not just a job, but a careerYokogawa, award winner for ‘Best Asset Monitoring Technology’ and ‘Best Digital Twin Technology’ at the HP Awards, is a leading provider of industrial automation, test and measurement, information systems and industrial services in several industries.Our aim is to shape a better future for our planet through supporting the energy transition, (bio)technology, artificial intelligence, industrial cybersecurity, etc. We are committed to the United Nations sustainable development goals by utilizing our ability to measure and connect.About The TeamOur 18,000 employees work in over 60 countries with one corporate mission, to ""co-innovate tomorrow"". We are looking for dynamic colleagues who share our passion for technology and care for our planet. In return, we offer you great career opportunities to grow yourself in a truly global culture where respect, value creation, collaboration, integrity, and gratitude are highly valued and exhibited in everything we do.Sobre nosotrosEl grupo Yokogawa, fundado en 1915 en Tokio, es actualmente líder mundial en el suministro de soluciones integradas de control de procesos. Y continuamos desarrollando y ofreciendo tecnología de punta, dentro del concepto ETS - Enterprise Technology Solutions -, que significa presentar la solución global al cliente, para el mejor costo/beneficio.Nuestro know-how internacional está certificado ISO:9001 y está a disposición de nuestros clientes, en toda su área de actividad, en relación con la optimización de la producción, los activos y la cadena de suministro con la aplicación efectiva de tecnologías digitales, permitiendo la transición hacia operaciones autónomas.En más de un siglo de historia, Yokogawa continúa trabajando por una sociedad sostenible a través de sus más de 17.000 empleados en una red global de 122 empresas que abarcan 61 países.Posición: SUPERVISOR QA/QCRequisitos académicos:Ingeniero titulado en la especialidad de Instrumentación y Control, Ingeniería Electrónica, Mecatrónica o Electricidad, Industrial. Titulado / Colegiatura habilitada vigente.Cursos o certificaciones en aseguramiento y control de calidad (QA/QC) de instrumentación.La acreditación será a través de copias de títulos y/o certificados académicos y certificado de habilidad CIP.Experiencia requerida:Experiencia acreditada acumulada mínima de 04 años en funciones relacionadas a actividades de aseguramiento y control de calidad de sistemas de instrumentación industrial y/o confiabilidad de sistemas de instrumentación, control y automatización en paradas de plantas del sector Oíl & Gas (Refinerías de Petróleo, Plantas Petroquímicas, Plantas de Fraccionamiento y licuefacción de Gas Natural, entre otras), energía, minas y afines.Experiencia comprobada como Supervisor QA/QC en refinerías o plantas del sector oíl & gas. Participación previa en al menos una parada de planta mayor, liderando inspecciones y liberación de trabajos relacionados con instrumentación.La acreditación será a través de certificados de trabajo y/o constancias de trabajo.Responsabilidades:Realizar levantamiento, inspección y liberación de algunos elementos de los sistemas de instrumentación como: Medidas de elementos primarios de medición (placas orificios, Venturi, Pitot), evaluación de rango y puntos de ajuste de instrumentos que difieran con el diseño original, cambios de materiales, entre otros.Supervisar y verificar que las actividades de instalación, calibración, pruebas y puesta en marcha de instrumentos cumplan con las especificaciones técnicas y estándares de calidad.Validar certificados de calibración, procedimientos, hojas de datos.Controlar la documentación técnica asociada al QA/QC de instrumentos: fichas de inspección, listas de verificación (checklists), ITPs (Inspection and Test Plans), RFI y NCR.Verificar el cumplimiento de las normativas de calidad y lineamientos de Certificación/Aceptación establecidos por Petro Perú para la ejecución de los trabajos de mantenimiento de la Instrumentación de la planta.Coordinar con las diferentes contratistas, proveedores de servicios especializados, disciplinas (Instrumentación, electricidad, Mecánica, Rotativos, entre otros) y/o departamentos (Operaciones, Técnica y Mantenimiento) que intervienen en la parada para el cabal cumplimiento del plan.Garantizar la confiabilidad operacional de los sistemas de instrumentación intervenidos durante la parada, mediante los sistemas de calidad y lineamientos de Certificación/Aceptación establecidos por PETROPERÚ.Elaborar y asegurar la documentación necesaria para el cierre documental de QA/QC y la entrega final de dossiers.Participar en reuniones de coordinación, seguridad y calidad durante la parada.Conocimientos específicos:Instrumentación de campo: transmisores de presión, temperatura, caudal, nivel, válvulas de control, interruptores de proceso, etc.Normativas y estándares aplicables (ISO, IEC, ANSI, entre otros).Conocimiento intermedio-avanzado en sistemas SCADA, PLC, sistemas de control DCS, sistemas instrumentados de seguridad SIS, F&G y sistemas de comunicación industrial (redes).Técnicas de calibración, configuración y lazo de verificación.Interpretación de diagramas P&ID, lazos de control (loop diagrams), planos eléctricos y de lógica.Gestión de informes de no conformidad (NCR), solicitud de inspección (RFI) y protocolos de prueba.Procedimientos de soldadura y montaje mecánico asociados a instrumentos (conocimiento básico).Manejo de herramientas de medición, software de calibración y plataformas digitales de control documental.Manejo de paquetes de computación: Office (Excel, Word, Power Point, Project).Competencias claves:Proactivo, dinámico, responsable, respetuoso, ético, liderazgo técnico y toma de decisiones. Rigurosidad en el cumplimiento de normas y especificaciones. Capacidad de análisis y resolución de problemas. Comunicación efectiva y trabajo en equipo. Enfoque en la mejora continua y aseguramiento de la calidad. Gestión de documentación técnica y control de registros. Adaptabilidad a ambientes críticos y trabajo bajo presión.Yokogawa quiere una cultura diversa, equitativa e inclusiva. Reclutaremos, desarrollaremos y promoveremos activamente a personas de diversos orígenes que difieren en términos de experiencia, conocimiento, estilos de pensamiento, perspectiva, antecedentes culturales y estatus socioeconómico. No discriminaremos por motivos de raza, color de piel, edad, sexo, identidad y expresión de género, orientación sexual, religión, creencias, opinión política, nacionalidad, etnia, lugar de origen, discapacidad, relaciones familiares o cualquier otra circunstancia. Yokogawa valora las diferencias y permite que todos pertenezcan, contribuyan, triunfen y demuestren todo su potencial.Al postularse para este puesto, usted reconoce y acepta que Yokogawa podrá recopilar, utilizar y procesar sus datos personales con el fin de gestionar el proceso de selección. Esto incluye evaluar su idoneidad para el cargo anunciado y realizar los trámites administrativos correspondientes.Asimismo, cuando sea necesario, sus datos podrán ser compartidos con proveedores de servicios externos autorizados, con el propósito de llevar a cabo las verificaciones necesarias y asegurar el cumplimiento de los requisitos legales y normativos aplicables.Yokogawa se compromete a proteger su privacidad, manejando sus datos personales bajo estrictos estándares de seguridad y confidencialidad. Al continuar con su solicitud, usted confirma haber leído, comprendido y aceptado esta declaración, otorgando su consentimiento para la recopilación, uso, divulgación y procesamiento de sus datos personales conforme a lo aquí establecido.Yokogawa is an Equal Opportunity Employer. Yokogawa wants a diverse, equitable and inclusive culture. We will actively recruit, develop, and promote people from a variety of backgrounds who differ in terms of experience, knowledge, thinking styles, perspective, cultural background, and socioeconomic status. We will not discriminate based on race, skin color, age, sex, gender identity and expression, sexual orientation, religion, belief, political opinion, nationality, ethnicity, place of origin, disability, family relations or any other circumstances. Yokogawa values differences and enables everyone to belong, contribute, succeed, and demonstrate their full potential.Are you being referred to one of our roles? If so, ask your connection at Yokogawaabout our Employee Referral process!",https://pe.linkedin.com/jobs/view/supervisor-qa-qc-at-yokogawa-4402999882?position=4&pageNum=0&refId=VL4fekJd%2Fy6AmP%2Bgg8xUoQ%3D%3D&trackingId=oRcnwX0%2BfRSZkej7v6vkxw%3D%3D
QA Automation,"Bluetab, an IBM Company",https://es.linkedin.com/company/bluetab?trk=public_jobs_jserp-result_job-search-card-subtitle,"Lima, Peru",11 hours ago,,,,https://pe.linkedin.com/jobs/view/qa-automation-at-bluetab-an-ibm-company-4402993211?position=5&pageNum=0&refId=VL4fekJd%2Fy6AmP%2Bgg8xUoQ%3D%3D&trackingId=1oH%2BJiLt0NRA9pLJiAjRqw%3D%3D
