Title job,Employer,Link profile employer,Location,How long ago,Recruiter,Profile recruiter,Description offer,Link offer
QA Funcional Jr,Indra,https://es.linkedin.com/company/indra?trk=public_jobs_jserp-result_job-search-card-subtitle,"San Isidro, Peru",2 hours ago,Emilyn Fernandez,https://pe.linkedin.com/in/emilyn-fernandez-562559145,"💡 ¡En Indra seguimos creciendo!Buscamos QA Funcionales Jr. para unirse a nuestro equipo.Si te apasiona la tecnología, tienes experiencia en plataformas de datos y quieres formar parte de una empresa global y en constante innovación, ¡queremos conocerte! 🌍Funciones del puesto:Diseñar el plan de Testing, casos de prueba y estrategia a aplicar para las distintas actividades de Testing necesarias.Preparación, identificación de data para la verificación de los productos desarrollados.Ejecutar los casos de prueba y llevar un registro de los defectos encontrados, así como realizar el seguimiento de estos hasta su adecuada corrección.Analizar y reportar los resultados de las pruebas.Brindar soporte en las actividades de integración y verificar que las versiones liberadas cumplan con los requisitos de calidad establecidos.Requisitos:Egresado universitario o técnico de Ingeniería de Sistemas, Informática o carreras afines.Experiencia de 1 a 2 años como QA Funcional.Experiencia en metodologías y modelos de calidad para la industria del software.Experiencia en medio de herramientas para la ejecución y seguimiento de pruebas.Experiencia en CMMI, ISTQB, Modelo en V, RUP.Experiencia en metodologías de desarrollo de sistemas (ágiles, no ágiles).Experiencia en Scrum/UML/TDD/BDD/IC.Experiencia en diferentes Tipos de Testing (volumen, Smoke test, performance, funcional, técnico).Experiencia en Pruebas Funcionales, Regresión, Integración y Aceptación.Experiencia en lenguajes de consulta de Base de Datos.Deseable experiencia en servicios Web - AWS: APIs.Deseable experiencia en la utilización de Postman, SoapUI o ReadyAPI como herramientas de automatización.Deseable experiencia en el lenguaje GherkinConocimiento en Automatización / Scripting.Beneficios:🚑 EPS 100%📚 Acceso total a Udemy para tu desarrollo profesional.🔖 Descuentos corporativos.📈 Línea de carrera.💆 ♀️ Kit ergonómico para laborar desde casa.🧠 Atención psicológica.🥦 Atención nutricional.Detalles de la posición:Modalidad: Híbrida (3 veces por semana en oficinas)Horario: Lunes a Viernes de 9:00am a 6:30pm.",https://pe.linkedin.com/jobs/view/qa-funcional-jr-at-indra-4338065932?position=1&pageNum=0&refId=4Z4kdeCIZu63HPtNKyD%2BwQ%3D%3D&trackingId=QrFXmBMkZXKY3%2F4o56D99g%3D%3D
QA Funcional,Softtek,https://mx.linkedin.com/company/softtek?trk=public_jobs_jserp-result_job-search-card-subtitle,"Lima, Peru",3 hours ago,Katherine Alarcon Carbajal,https://pe.linkedin.com/in/katherine-alarcon-carbajal-b94359230,"Softtek es un proveedor global de servicios orientados a procesos de TI con más de 30 oficinas en Norteamérica, Latinoamérica, Europa y Asia. Maximizamos el valor del software para el mundo: Creamos, Probamos, Implementamos y damos mantenimiento a sistemas que empoderan organizaciones e individuos. En la actualidad nos encontramos en la búsqueda de un talento para el perfil: QA Funcional SeniorRequisitos:Experiencia de 4 años a más en la especialidad.Competencia técnica avanzado en Ingeniería de Sistemas, Informática o afines.Competencia técnica de metodologías y modelos de calidad para la industria del softwareCompetencia técnica avanzados de herramientas para la ejecución y seguimiento de pruebasCompetencia técnica de CMMI, ISTQB, Modelo en V, RUPCompetencia técnica en IVR (indispensable).Metodologías de desarrollo de sistemas (ágiles, no ágiles).Competencia técnica de Scrum/UML/TDD/BDD/IC, experiencia en caso de asignaciones a equipos ágiles.Competencia técnica de diferentes Tipos de Testing (volumen, Smoke test, performance, funcional, técnico).Experiencia en Pruebas Funcionales, Regresión, Integración y Aceptación.Competencia técnica avanzados de lenguajes de consulta de Base de Datos.Manejo avanzado de lenguaje Gherkin (indispensable).Competencia técnica en Automatización de pruebas funcionales con SerenityBDD (indispensable)Ofrecemos:Ingreso a planilla con todos los beneficios de ley.EPS al 100%Modalidad de trabajo: HIBRIDOCapacitación constante y línea de carrera.Podrás optar por los descuentos corporativos en empresas de entretenimiento, educación, entre otros.Contamos con una plataforma exclusiva virtual con más de 3,000 cursos orientados a potencializar tus habilidades técnicas como blandas.En Softtek reconocemos que el talento es diverso; respetamos la identidad y condiciones de vida de cada persona y promovemos la equidad de trato y de oportunidades. Para lograr lo anterior, creamos un ambiente incluyente en el cual las personas muestran qué las define y emplean sus diferentes características para lograr mejores resultados.Por ello, promovemos la diversidad generacional, origen étnico, nacionalidad y la inclusión de personas con habilidades diferentes y/o discapacidad. En cumplimiento de la Ley N° 29973 y su reglamento.",https://pe.linkedin.com/jobs/view/qa-funcional-at-softtek-4334970423?position=2&pageNum=0&refId=4Z4kdeCIZu63HPtNKyD%2BwQ%3D%3D&trackingId=js0dBHQiRCiuhH122aNm2Q%3D%3D
Practicante Pre QA,Valtx Perú,https://pe.linkedin.com/company/valtx-peru?trk=public_jobs_jserp-result_job-search-card-subtitle,"San Borja, Peru",53 minutes ago,,,"En Valtx, empresa con 24 años de experiencia en el mercado peruano, cuyo objetivo principal es convertirse en un socio estratégico, mediante soluciones tecnológicas en los diversos aspectos de los procesos de negocios; el desarrollo, implementación y mantenimiento de aplicaciones e infraestructura tecnológica para el negocio; y consultoría en diversos procesos de transformación, nos encontramos en la búsqueda de un PRACTICANTE PRE- QA¿Qué responsabilidades tendrá? Apoyar en la elaboración y ejecución de casos de prueba funcionales y de regresión. Registrar defectos encontrados en las herramientas de gestión. Colaborar en la documentación de resultados de pruebas y generación de evidencias. Participar en la preparación de datos de prueba y ambientes de validación. Realizar pruebas exploratorias o de validación inicial de componentes desarrollados. Apoyar en la automatización de pruebas. Mantener actualizada la trazabilidad de requerimientos y casos de prueba. Cumplir los estándares y lineamientos definidos en la metodología de pruebas del área.¿Qué requisitos necesito? Estudiante universitario o técnico de los últimos ciclos de las carreras de Ingeniería de Sistemas, Software o Informática, Computación o afines. Compromiso y disposición horaria (30 horas semanales). Conocimiento de fundamentos de testing de software. Conocimiento de Ciclo de vida del desarrollo (SDLC). Conocimiento de herramientas de gestión de pruebas (Jira, TestLink o Azure DevOps). Consultas SQL básicas. Postman (nivel básico). Conocimientos básicos en control de versiones y documentación . Disponibilidad para trabajar de manera presencial en San Borja.",https://pe.linkedin.com/jobs/view/practicante-pre-qa-at-valtx-per%C3%BA-4334941333?position=3&pageNum=0&refId=4Z4kdeCIZu63HPtNKyD%2BwQ%3D%3D&trackingId=yy7ozvD1t3pAeF5OAX1Fdw%3D%3D
Analista QA de datos,"Laureate Education, Inc.",https://www.linkedin.com/school/laureate-education/?trk=public_jobs_jserp-result_job-search-card-subtitle,"Lima, Peru",7 hours ago,,,"Laureate es una corporación con presencia internacional, cuyo propósito es proporcionar acceso a una educación asequible y de alta calidad, mediante nuestras instituciones UPC, UPN y Cibertec, atendiendo a más de 200 Mil estudiantes a nivel nacional. ¡Contribuye con el equipo que promueve el desarrollo del país a través de la educación! Nos encontramos en la búsqueda de: Analista de QA DataMISIÓN DEL PUESTO:Asegurar la calidad, confiabilidad y consistencia de los procesos y soluciones de datos implementados en la nube de Azure (DataFactory, Synapse, Data Lake y demás servicios relacionados), mediante la planificación, ejecución y automatización de pruebas que garanticen información íntegra y oportuna para la toma de decisiones del negocio.FORMACIÓN Y EXPERIENCIA:Bachiller en Ingeniería de Sistemas, Informática o carreras afines.Experiencia mínima de 2 a 3 años en QA de proyectos de Data & Analytics.Experiencia validando procesos ETL/ELT en plataformas cloud (Azure, AWS o GCP).Certificación en ISTQB, Azure Data Engineer o Azure Data Fundamentals.CONOCIMIENTO:Azure Data Factory: validación de pipelines, orquestación y monitoreo de cargas.Azure Synapse Analytics: validación de queries, performance y consistencia de data.Azure Data Lake: control de integridad y trazabilidad en la ingesta y almacenamiento de datos.SQL avanzado para validación de grandes volúmenes de información.Herramientas de gestión de pruebas (Jira, Azure DevOps etc.).Power BI u otras herramientas de visualización para validar reportes y dashboards.FUNCIONES:Diseñar planes, escenarios y casos de prueba para procesos de integración y explotación de datos.Verificar integridad, calidad y trazabilidad de la información en pipelines de Azure Data Factory.Validar modelos, queries y performance en Azure Synapse Analytics, garantizando resultados consistentes.Revisar la ingesta, almacenamiento y organización de la data en Azure Data Lake, asegurando estructura y formato.Registrar, priorizar y dar seguimiento a defectos encontrados en la cadena de datos.Desarrollar y mantener scripts de validación de data para reducir reprocesos y mejorar eficiencia.Trabajar con equipos de Arquitectura, Data Engineering y BI para asegurar entregables alineados a los estándares de calidad.Proponer e implementar prácticas, métricas y herramientas que fortalezcan el control de calidad en entornos cloud.BENEFICIOS:Contrato en planilla.EPS AL 50% y Seguro Oncológico al 100%.Descuentos corporativos.Descuentos educativosModalidad remota",https://pe.linkedin.com/jobs/view/analista-qa-de-datos-at-laureate-education-inc-4321179152?position=4&pageNum=0&refId=4Z4kdeCIZu63HPtNKyD%2BwQ%3D%3D&trackingId=zktCVxmstEBXlGYDp1PC%2Bg%3D%3D
QA Engineer,Moventi,https://www.linkedin.com/company/moventi-global?trk=public_jobs_jserp-result_job-search-card-subtitle,"Lima, Peru",21 hours ago,Renzo Bazan Reyna,https://pe.linkedin.com/in/renzo-bazan-reyna-247214182,"En Moventi, consultora de tecnología especializada en cloud, desarrollo de software a medida, RPA e inteligencia artificial, nos encontramos en búsqueda de un QA Engineer que se sume a nuestro equipo de proyectos.RequisitosEgresado o bachiller de Ing. de Sistemas, Informática, Computación o SimilaresExperiencia mínima de cinco (5) años como QA Engineer o similares - comprobable con certificados de trabajoExperiencia en automatización de pruebas, pruebas funcionales y no funcionalesExperiencia en Banca y/o finanzasIndispensable Certificación ISTQBOfrecemosPlanilla desde el primer díasOportunidades de CrecimientoTrabajo híbrido en San Borja",https://pe.linkedin.com/jobs/view/qa-engineer-at-moventi-4334644268?position=5&pageNum=0&refId=4Z4kdeCIZu63HPtNKyD%2BwQ%3D%3D&trackingId=S%2Bgk%2FNwQtoQt283pD6qy7A%3D%3D
Mid-Level Manual QA Engineer - Remote - Latin America,FullStack,https://www.linkedin.com/company/fullstack-labs?trk=public_jobs_jserp-result_job-search-card-subtitle,"Lima, Peru",10 hours ago,,,"About FullStackFullStack is the most transparent IT talent network, connecting highly skilled individuals with top global companies and Silicon Valley startups for remote, on-demand projects. We focus on building a trusted, high-performance network where talent can thrive in a positive, respectful, and supportive environment. By prioritizing transparency, fair opportunities, and professional growth, we empower our engineers to deliver their best work while collaborating with innovative teams worldwide.We’re Most Proud OfOffering life-changing opportunities for talented software professionals across the Americas.Enhancing highly-skilled software development teams of hundreds of the world’s greatest companies.Our 4.2-star rating on GlassDoor.Our client Net Promoter Score of 68, twice the industry average.The OpportunityJoin our talent network and connect with U.S. clients for flexible, project-based development work as a Mid-Level Manual QA Engineer.You will integrate directly into our client's team and work alongside their existing designers and engineers on a daily basis.What We're Looking For4+ years of professional Manual QA experience.Advanced English is required.Successful completion of a four-year college degree is required.Proven experience performing manual testing of browser-based CRM or web applications.Hands-on experience designing, executing, and documenting test cases for UI, functionality, and regression testing.Strong understanding of QA methodologies, defect tracking, and testing best practices.Familiarity with CRM platforms, with experience testing business workflows and data-driven processes.Practical experience using browser-based automation tools such as Playwright, Selenium, or mabl is a plus.Collaborative and detail-oriented, with the ability to communicate clearly with developers and product teams.Ability to work through new and difficult issues and contribute to libraries as needed.Ability to create and maintain continuous integration and delivery of applications.Forensic attention to detail.A positive mindset and a can-do attitude.Experience working on Agile / Scrum teams.Meaningful experience working on large, complex systems.Ability to take extreme ownership over your work. Every day is a challenge to ensure you are performing to the expectations you and your team have agreed upon.Ability to identify with the goals of FullStack's clients, and dedicate yourself to delivering on the commitments you and your team make to them.Ability to consistently work 40 hours per week.What We OfferCompetitive pay.100% remote work.The ability to work with leading startups and Fortune 500 companies.Continuing education opportunities.Opportunity to grow and expand your career.Our talent network is committed to fostering a diverse, inclusive, and accessible environment where IT professionals can find opportunities that match their skills. We welcome individuals of all races, religions, genders, sexual orientations, national origins, abilities, and experiences. Our focus is on connecting talent with projects based on qualifications, ensuring a fair and transparent process that values diverse perspectives and global collaboration.Learn more about our Applicants Privacy Notice.",https://pe.linkedin.com/jobs/view/mid-level-manual-qa-engineer-remote-latin-america-at-fullstack-4334846624?position=6&pageNum=0&refId=4Z4kdeCIZu63HPtNKyD%2BwQ%3D%3D&trackingId=BBKuW7u5%2BCwYeoEKTMfggw%3D%3D
Software Developer Engineer in Test - Work from home,Nearsure,https://www.linkedin.com/company/nearsure?trk=public_jobs_jserp-result_job-search-card-subtitle,Lima Metropolitan Area,7 hours ago,,,"Explore the Nearsure experience!🌐 Join our close-knit LATAM remote team: Connect through fun activities like coffee breaks, tech talks, and games with your team-mates and management.🍃 Say goodbye to micromanagement! We champion autonomy, open communication, and respect for diversity as our core values.⚖️Your well-being matters: Our People Care team is here from day one to support you with everything from time-off requests to wellness check-ins.Plus, our Accounts Management team ensures smooth, effective client relationships, so you can focus on what you do best.Ready to grow with us? 🚀 Here’s what we offer you by joining us!✨ Competitive USD salary 💲 – We value your skills and contributions!🌐 100% remote work 🏢 – While you can work from anywhere, you’re always welcome to connect with teammates and grow your network at our coworking spaces across LATAM!💼 Paid time off – Take the time you need according to your country’s regulations, all while receiving your full salary. Rest, recharge, and come back stronger!🎉 National Holidays celebrated 🌴 – Take time off to celebrate important events and traditions with loved ones, fully embracing your culture.😷 Sick leave – Focus on your health without the stress. Take the necessary time to recover and feel better.💸 Refundable Annual Credit – Spend it on the perks you love to enhance your work-life balance!🤝 Team-building activities – Join us for coffee breaks, tech talks, and after-work gatherings to bond with your Nearsure family and feel part of our vibrant community.🥳 Birthday day off 🎂 – Enjoy an extra day off during your birthday week to celebrate in style with friends and family!About the project:As a Software Developer Engineer in Test, you will play a key role in ensuring the quality and reliability of our cloud infrastructure pipelines. You’ll collaborate with a global team to build and maintain automation frameworks and testing solutions that enhance our delivery process, making it faster, more robust, and more efficient.How you'll contribute✅ Design, develop, and maintain automated tests for infrastructure-as-code (IaC) components, including Terraform and Ansible.✅ Test and validate cloud infrastructure pipelines and configuration code.✅ Contribute to continuous integration and deployment pipelines (CI/CD) using modern DevOps tools.✅ Collaborate closely with developers, DevSecOps engineers, and other SDETs to ensure high test coverage and reliability.✅ Drive improvements in testing processes, frameworks, and automation strategies.This would make you the ideal candidate✨ Bachelor's Degree in Computer Science, Engineering, or a related field.✨ 4+ Years of experience working with the full QA lifecycle and methodologies.✨ Experience testing infrastructure-as-code solutions (Terraform, Ansible, or similar).✨ Solid scripting or programming skills (e.g., Python, JavaScript/TypeScript, Go, or similar).✨ Proven experience in test automation (writing, maintaining, and scaling automated tests).✨ Familiarity with DevOps tools and practices (CI/CD, containerization, pipeline configuration— preferably GitLab, but Jenkins, GHA, or similar is fine).✨ Advanced English Level is required for this role, as you will work with US clients. Effective communication in English is essential to deliver the best solutions to our clients and expand your horizons.What to expect from our hiring process1. Let’s chat about your experience!2. Impress our recruiters, and you’ll move on to a technical interview with our top developers.3. Nail that, and you’ll meet our client - your final step to joining our amazing team!🎯 At Nearsure, we’re dedicated to solving complex business challenges through cutting-edge technology and we believe in the power of tailored solutions. Whether you are passionate about transforming businesses with Generative AI, building innovative software products, or implementing comprehensive enterprise platform solutions, we invite you to be part of our dynamic team!We would love to hear from you if you are eager to make an impact and join a collaborative team that values creativity and expertise.Let’s work together to shape the future of technology! 🧑 💻 Apply now! By applying to this position, you authorize Nearsure to collect, store, transfer, and process your personal data in accordance with our Privacy Policy. For more information, please review our Privacy Policy. (https://www.nearsure.com/privacy-policy)",https://pe.linkedin.com/jobs/view/software-developer-engineer-in-test-work-from-home-at-nearsure-4321289043?position=7&pageNum=0&refId=4Z4kdeCIZu63HPtNKyD%2BwQ%3D%3D&trackingId=omM8hxs9OqAwuJPg1PFLew%3D%3D
QA Automation Engineer (Cypress/Playwright),Applaudo,https://sv.linkedin.com/company/applaudo?trk=public_jobs_jserp-result_job-search-card-subtitle,"Lima, Peru",2 hours ago,,,"About YouYou are a QA Automation Engineer passionate about building high-quality, reliable, and efficient testing frameworks. You thrive in fast-paced environments where automation, collaboration, and performance drive success. You take pride in writing clean, maintainable test code and contributing to a culture of continuous improvement.You bring to Applaudo the following competencies:Bachelor’s Degree in Computer Science, Software Engineering, or related field — or equivalent practical experience.5+ years of experience in QA Automation, focused on web applications.Strong proficiency in JavaScript/TypeScript for automation scripting.Hands-on experience with Cypress.io and/or Playwright frameworks.Proven experience performing API testing using Postman or Cypress built-in tools.Experience integrating automated tests into CI/CD pipelines using tools such as CircleCI, Harness, or GitHub Actions.Proficiency with version control systems (Git, Bitbucket, GitHub).Familiarity with Agile/Scrum methodologies and cross-functional collaboration.Excellent problem-solving and analytical skills, with strong attention to detail.Experience with performance testing or Salesforce test automation is a plus.English Full Professional Proficiency.You will be accountable for the following responsibilities:Plan, analyze, design, develop, execute and maintain manual and automated test scenarios and test data, this includes determining priority for test scenarios and creating execution plans to implement these scenarios.Identify opportunities for automation within software processes.Identify and clearly document bugs found. Deliver regular reports on bugs found.Support design and execute test automation strategy for the projects along with other developers and QA Analysts.Coordinate the test plans with project managers, development managers and othersInitiate the analysis, design, implementation, and execution of tests, monitor test progress and results, and check the status of exit criteria (or definition of done)Automate collection and delivery of test progress and test summary reports.Support the selection and implementation of automation tools.Introduce suitable metrics for measuring test progress and evaluating the quality of the testing.Additional InformationHere at Applaudo Studios values as trust, communication, respect, excellence and team work are our keys to success. We know we are working with the best and thus treat each other with respect and admiration without asking.Submit your application today, and don't miss this opportunity to join the Best Digital team in the Region!We truly appreciate all the hard and outstanding work our team makes every day at Applaudo Studios, and that's why the perks that we offer, are deeply thought and designed as a way to thank them for their commitment and excellence.Some of our perks and benefits:CelebrationsSpecial discounts*Entertainment area*Modern Work Spaces*Great work environmentPrivate medical insurance**Benefits may vary according to your location and/or availability. Request further information when applying.",https://pe.linkedin.com/jobs/view/qa-automation-engineer-cypress-playwright-at-applaudo-4334930728?position=8&pageNum=0&refId=4Z4kdeCIZu63HPtNKyD%2BwQ%3D%3D&trackingId=WwYNualkClUszsZht1%2Fc%2Fw%3D%3D
